Product Number,Brand,Product Name,Price,Category,Subcategory,Weight (g),Weight (ml),Stock Status,Review Count,Rating,Benefits,Key Ingredients,Made Without,Usage,Ingredients,Hero Image,Link
1422,Dr. Lara Devgan,Platinum Long Lash Serum 5ml,$245.00,Skincare,Eye Care,,5.0,In Stock,2.0,3.0,"Lengthening, Fragrance-free",Vitamin B5: Supports more rapid hair growth. Phyto Peptides: Stimulate visible growth at the follicle. Clover Flower Extract: Supports a strong hair follicle structure.,"Fragrance, Dyes, Sulfates, Parabens, Gluten, Formaldehyde, Propylene glycol, Hexylene glycol.","Apply a small amount of Platinum Long Lash to the base of clean, dry eyelashes and/or eyebrows once or twice a day.","Dr. Lara Devgan's cult-favorite eyelash and eyebrow serum enhances the appearance of the length, density, and thickness of eyelashes and eyebrows. Platinum Long Lash™s hair-stimulatory nutrients and lightweight liquid formula promote the appearance of longer lashes and healthier brows.",https://contenthub-delivery.mecca.com/api/public/content/I-068995-I-068995-M1-DrLaraDevgan-PlatinumLongLash-ZSnkoNiVT2ykTNNfyvFGRg.webp?t=blur,https://www.mecca.com/en-au/dr-lara-devgan/platinum-long-lash-serum-I-068995/?cgpath=skincare
1425,Morphe,Morphe 2 Hit The Dot Spot Solution,$24.00,Skincare,Treatment,,,In Stock,7.0,4.3,"Anti-blemish, De-congesting, Smoothing, Soothing, Fragrance-free","Calamine lotion: soothes, calms, and cools stressed-out skin. Salicylic acid: balances and gently exfoliates for smoother, clearer-looking skin. Sulfur: cleanses and helps reduce the appearance of spots. Willow bark: soothes irritation and dissolves pore-clogging impurities.","Sulphates, parabens, phthalates, fragrance.","Do not shake. Before bed, dip a cotton swab into the pink solution and apply gently to spot. Rinse off in the morning. Do not use on broken skin or the eye area.","Stop spots with one drop. Sleep off your skin concerns with this fragrance-free, fast-acting spot treatment that works overnight to reduce the look of imperfections and inflammation. Astringent calamine lotion, which is known to soothe and cool, calms stressed-out skin. Salicylic acid and sulfur exfoliate and refresh skin. Wilow bark and wintergreen leaf extract help to relieve redness.",https://contenthub-delivery.mecca.com/api/public/content/I-049898-I-049898-M1-Morphe-Morphe2HitTheDotSpotSolution.webp?t=blur,https://www.mecca.com/en-au/morphe/morphe-2-hit-the-dot-spot-solution-I-049898/?cgpath=skincare
1430,Skinstitut,Eye & Neck Cream 30ml,$64.00,Skincare,Eye Care,,30.0,In Stock,,0.0,"Hydrating, Brightening, Firming, Plumping","Peptide Complex: a proprietary Peptide Complex improves skin function, helping regenerate and renew skin on a cellular level by stimulating synthesis of integrins and keratins to improve barrier function and skin firmness. Marine Collagen: vitamin and mineral-rich Marine Collagen improves cell integrity, helping prevent moisture loss and improving hydration.",Parabens and sulphates.,"Twice daily, after cleansing. For the eyes, apply a half pea-sized amount and pat gently with your ring finger along the orbital bone and surrounding eye area. For the neck, apply a pea-sized amount to your neck area and using finger tips, apply in an upward motion.","A rich and creamy anti-ager that unleashes powerful synthetic peptides to boost your natural collagen production; in the process, those signs of premature ageing are softened and skin is lifted, tightened and toned.",https://contenthub-delivery.mecca.com/api/public/content/I-059293-I-059293-M1-SkinStitut-UltrafirmingEyeandNeckCream-NRxE5JYlUK6Ewdn3ffw6w.webp?t=blur,https://www.mecca.com/en-au/skinstitut/eye-neck-cream-V-059293/?cgpath=skincare
1434,BeautyBio,Bright Eyes Collagen-Infused Brightening Colloidal Silver Eye Gels 15 Pairs,$66.00,Skincare,Eye Care,,,In Stock,46.0,4.5,"Hydrating, Brightening, Firming, Plumping, Smoothing, Soothing, De-puffing","Pure Colloidal Silver: Encourages skin rejuvenation to give the look of 10 hours of rest after just 10 minutes of application. Illuminating Pearl: Helps eyes instantly appear brighter. Natural Collagen: Firms and tightens skin to hide lack of sleep from the night before. Aloe Vera: A true superhero ingredient chock-full of vitamins, minerals and detoxing agents that promote healthy looking skin. The high concentration of salicylic acid acts as a healing and anti-aging agent.","Sulfates (SLS & SLES), Parabens, Formaldehyde, No animal testing, Triclosan, Hydroquinone, Triclocarban, Oxybenzone","Step 1 Cleanse face and pat dry. Step 2 Remove Bright Eyes gels from clear adhesive and place onto under-eye area avoiding direct contact with eye. Step 3 Allow key ingredients to soak into the eye area for at least 10 minutes. Step 4 After removing under eye gels, follow with your favorite facial serum and moisturizer. For AM + PM use.","BeautyBio's Bright Eyes are a set of 15 illuminating and cooling colloidal silver infused eye gel patches that instantly de-puff, brighten and revitalize the delicate eye area in 10 minutes with natural collagen to fill in the appearance of fine lines.",https://contenthub-delivery.mecca.com/api/public/content/I-045436-I-045436-M1-BeautyBio-BrightEyesCollagenInfusedBrighteningColloidalSilverEyeGels-KXc5OUGJQk23tl6iMdQeqw.webp?t=blur,https://www.mecca.com/en-au/beautybio/bright-eyes-collagen-infused-brightening-colloidal-silver-eye-gels-V-854199/?cgpath=skincare
1436,GOOP,Goopglow Vitamin C Brightening Eye Cream 15ml,$74.00,Skincare,Eye Care,,15.0,In Stock,14.0,3.5,"Hydrating, Brightening, Soothing, De-puffing, Oil free, Fragrance-free, Alcohol-free","Vitamins A, B3 (Niacinamide), and C: help promote cell turnover, soothe, and brighten. Caffeine and Tomato Fruit Extract: instantly energize, depuff, and make the eye area appear awake.","Parabens, petroleum, phthalates, SLS, SLES, PEGs, TEA, DEA, silicones, or artificial dyes and fragrances.",Gently apply to clean skin beneath and around the eyes a.m. and p.m.,"This gel cream cocoons the eye area to hydrate, brighten, and reduce the look of fine lines and wrinkles, blurring and instantly absorbing to layer well under makeup. It’s boosted with caffeine and carotenoid-rich tomato fruit extract to wake up the eyes and instantly energize and depuff.",https://contenthub-delivery.mecca.com/api/public/content/I-058200-GoopBeauty_GoopGlow_VITA-C-Brightening-Eye-Cream_s_1_no-shadown-Xd5lNgqbR0mrRk3GIrH0g.webp?t=blur,https://www.mecca.com/en-au/goop/goopglow-vitamin-c-brightening-eye-cream-I-058200/?cgpath=skincare
1439,OSEA,Advanced Protection Cream 55ml,$177.00,Skincare,Moisturisers,,55.0,In Stock,453.0,4.3,"Hydrating, Brightening, Plumping","Bio Retinol: Extract derived from bidens pilosa plant that acts as a safe, stable alternative to retinol, visibly improves lines and wrinkles without irritation. Undaria Seaweed: Replenishes the skin’s moisture barrier and keeps skin looking healthy. Marine Extract (Exopolysaccharide): Soothes and softens skin for healthy looking skin. Biomimetic lipid complex: Supports skin’s moisture barrier, increases skin hydration and visibly smooths skin. DPHP (Dipalmitoyl Hydroxyproline): A plant-derived amino acid firms the look and feel of skin leaving it super supple. Turmeric: Promotes brighter skin for a more youthful look.",,"Massage into face and neck until absorbed. Use morning and night, after cleanser and serum and before face oil.","Discover long-lasting marine moisture with the power to restore youthful looking skin. Our most nourishing, ultra-rich cream firms skin, reduces wrinkle appearance and promotes a radiant, even complexion.",https://contenthub-delivery.mecca.com/api/public/content/I-069472-I-069472-M1-Osea-AdvancedProtectionCream-JHnMWtbnTXKbNXMTCGfPUg.webp?t=blur,https://www.mecca.com/en-au/osea/advanced-protection-cream-I-069472/?cgpath=skincare
1442,Moon Juice,Cosmic Cream Collagen Protecting Moisturizer 50ml,$95.00,Skincare,Moisturisers,,50.0,In Stock,32.0,4.5,"Hydrating, Brightening, Firming","Adaptogenic ashwagandha: revitalises skin and protects against environmental stressors. Adaptogenic schisandra: helps protect collagen and improve firmness and elasticity. Hyaluronic acid: helps bind water to skin, increase elasticity, and smoothness. Adaptogenic reishi: supports skin's resilience and helps improve barrier function. Silver ear mushroom: locks hydration for long-term moisture and supports barrier function. Tocotrienols (vitamin E): helps provide antioxidant protection.","Parabens, petroleum, pesticides, propylene or butylene glycols, phthalates, sulphates, PEGs, TEA, DEA, GMO, silicones, gluten, alcohol, artificial dyes, artificial fragrances, animal products or testing.","Apply to the face and neck, morning and night. Using your ring finger, gently press the cream across your under eye area to double as an eye cream.","A daily moisturiser should be reliable and a potent multitasker, and Moon Juice’s Cosmic Cream™ is just that. Formulated with ashwagandha, schisandra, silver ear mushroom and hyaluronic acid, this adaptogenic blend helps improve firmness and elasticity while fortifying the skin barrier to lock in hydration and protect collagen. The rich, creamy texture has a glide to it and melts in fast to keep skin looking dewy.",https://contenthub-delivery.mecca.com/api/public/content/I-047499-I-047499-M1-MoonJuice-CosmicCreamCollagenProtectingMoisturizer.webp?t=blur,https://www.mecca.com/en-au/moon-juice/cosmic-cream-collagen-protecting-moisturizer-I-047499/?cgpath=skincare
1445,Officine Universelle Buly,Eau Superfine Rosewater Facial Toner 190ml,$79.00,Skincare,Cleanser & Toner,,190.0,In Stock,10.0,4.6,Brightening,"Rose floral water: helps soothe redness and inflammation while toning and balancing the skin. Glycerin: replenishes the skin and helps to maintain the skins barrier function, preventing moisture loss and its tell-tale signs of dry, scaly skin. Citric acid: gently exfoliates the skin, leaving it smoother, brighter and more even-toned.",Packaged in a plastic-free protective glass bottle.,Dispense onto a cotton pad or hands and sweep across the face. Can be used morning and night. Can also be used as a soothing after-shave treatment.,"Lightweight and beautifully scented, this soothing toner purifies and balances the skin, ridding it of makeup and impurities to reveal a smoothed, softened complexion with a radiant natural glow.",https://contenthub-delivery.mecca.com/api/public/content/I-040534-I-040534-M1-OfficineUniverselleBuly-EauSuperfineRosewaterFacialToner.webp?t=blur,https://www.mecca.com/en-au/officine-universelle-buly/eau-superfine-rosewater-facial-toner-I-040534/?cgpath=skincare
1452,NARS,Light Reflecting Eye & Lash Gel 15ml,$89.00,Skincare,Eye Care,,15.0,In Stock,9.0,4.4,"Hydrating, De-puffing, Fragrance-free, Alcohol-free","Hyaluronic acid: helps to moisturise, reduce inflammation, prevent water loss and boost skin’s elasticity and plumpness. Pro-Vitamin B5: smooths and brightens. Hyaluronic Filling Spheres: lock moisture into skin, while smoothing the appearance of fine lines and wrinkles.","Mineral oil, talc, fragrance, alcohol, parabens, sulphates, phthalates.","Apply a pea-sized dollop all around the eye to treat the undereyes, lids, and crow’s feet. To treat lashes, apply only at nighttime, using a fingertip to gently swipe along lash lines. Avoid direct contact with eyes.","A powerful, quick-absorbing gel formula that gently treats eyes and lashes with an all-in-one formula. It revitalizes and refreshes the eye area and improves the look of undereye bags. A blend of peptides, Hyaluronic Acid, and Pro-Vitamin B5 work together to smooth and brighten the eye area, while giving lashes a fuller, longer, thicker look. Hyaluronic",https://contenthub-delivery.mecca.com/api/public/content/I-053369-I-053369-M1-NARS-LightReflectingEyeLashGel-n3uK1O8pkGuksY14mGVw.webp?t=blur,https://www.mecca.com/en-au/nars/light-reflecting-eye-lash-gel-I-053369/?cgpath=skincare
1465,Horace,Moisturizing Eye Cream 15ml,$38.00,Skincare,Eye Care,,15.0,In Stock,2.0,4.5,"Hydrating, De-congesting, De-puffing, Fragrance-free",Caffeine Hyaluronic Acid Organic Aloe Vera Juice Sequoia Extract,Silicone and fragrance.,"Apply a small amount in the morning and/or evening, massage in with the metal tip, then finish by dabbing with your fingers.",The Moisturizing Eye Cream moisturises and smooths the eye contour area. Daily use visibly reduces dark circles and diminish puffiness. The reusable metal applicator immediately refreshes and decongests the eye area. You'll look energised and radiate with a healthy glow.,https://contenthub-delivery.mecca.com/api/public/content/I-063579-I-063579-M1-Horace-MoisturizingEyeCream-tk8dqD4eqkWSkFmspJu2wA.webp?t=blur,https://www.mecca.com/en-au/horace/moisturizing-eye-cream-I-063579/?cgpath=skincare
1471,Goldfaden MD,Pure Start 150ml,$64.00,Skincare,Cleanser & Toner,,150.0,In Stock,38.0,4.6,"Cruelty-free, Vegan, Hydrating",Grapefruit: cleanses and tones whilst providing antioxidant protection Rose hip: helps to firm and smooth the skin whilst providing advanced hydration Seaweed extract: improves moisture levels and enhances skins natural radiance,"Silicones, gluten, mineral oil, parabens, alcohol","Gently massage a liberal amount of cleanser to damp skin. Rinse with warm water and pat skin dry. For optimal results, use morning and night.","Remove makeup, surface oils, dirt and impurities in one simple step with this multi-tasking pH-balanced cleanser that clarifies the skin without irritating or drying. Skin is left clear, smooth and refreshed. Suitable for all skin types.",https://contenthub-delivery.mecca.com/api/public/content/I-021946-I-021946-M1-GoldfadenMD-PureStart-4GGujyJlF0azYhB2jSRo1A.webp?t=blur,https://www.mecca.com/en-au/goldfaden-md/pure-start-I-021946/?cgpath=skincare
1477,Murdock Barbers of London,No Fuss Beard,$80.00,Skincare,Skin Care Packs,,200.0,In Stock,,0.0,,,,Beard Shampoo: Massage a thumbnail amount into the beard and rinse through with water. Beard Moisturiser: Run two pumps upwards through facial hair as close to the skin as possible. Suitable for daily use,"Everything a beard needs for peak health and minimal itchiness in two simple steps. The Beard Shampoo's Ph balanced formula cleanses without irritation & Our Beard Moisturiser conditions and moisturises both the beard and skin underneath. No fuss, Just handsome.",https://contenthub-delivery.mecca.com/api/public/content/I-070456-I-070456-M1-MurdockBarbersOfLondon-NoFussBeard-brrTyTieRFqCYeJbRncoqA.webp?t=blur,https://www.mecca.com/en-au/murdock-barbers-of-london/no-fuss-beard-I-070456/?cgpath=skincare
1478,Sodashi,Serum No.21 30ml,$131.00,Skincare,Treatment,,630.0,In Stock,,0.0,"Vegan, Hydrating, Brightening, Exfoliating, Firming, Evens Skin Tone, Plumping, Smoothing","Bakuchiol: natural alternative to retinol, stimulates cell turnover and collagen production. Rosehip: Effective emollient and moisturiser, fatty acids soften skin and improve skin barrier health, brightens and evens skin tone. Calendula: Soothes irritation and sensitivity, anti-inflammatory properties, helps plump and tighten the skin. Kakadu Plum: powerful antioxidant, Australian native, brightens the skin and fights against free radical damage. Vitamin E: Helps prevent UV induced free radical damage, reduces inflammation post UV exposure, and helps in the prevention of premature ageing. Sandalwood: Relieves itching and inflammation, anti-microbial properties, effectively hydrates and balances the skin. Prickly Pear: Contains essential proteins for healthy skin cells, stimulates new cell growth, helps to restore elasticity, moisturises and brightens skin. Sweet Orange: Plumps and brightens the skin, detoxifies congested pores and supports collagen formation, increases circulation. Avocado: Restores moisture and nourishment to dry and mature skin, protects the skin from environmental stressors, rich in Vitamin A, D & E.","Synthetic fragrances and colours, sulphates, parabens, silicones, preservatives, mineral oils and phthalates.","Apply daily on clean skin. Warm 1 – 2 drops of serum between hands and apply on the face, neck and décolletage. Store product below 30°C/86°F. Avoid contact with eyes.","Serum No. 21 is an innovation in plant-based skincare, this clinically proven formula deeply hydrates, supports cell regeneration, boosts collagen production, smooths wrinkles, and firms. Dermatologist approved, it’s suitable for all skin types including sensitive. Formulated with over 20 of the world’s most nutrient-rich botanicals.",https://contenthub-delivery.mecca.com/api/public/content/I-069280-I-069280-M1-Sodashi-Serum21-ZSKVALX6T2iIFaVSIWqLXA.webp?t=blur,https://www.mecca.com/en-au/sodashi/serum-no21-I-069280/?cgpath=skincare
1493,RMS beauty,Kakadu Beauty Oil 30ml,$105.00,Skincare,Treatment,,30.0,In Stock,2.0,3.0,Vegan,"Kakadu Plum Seed Oil: One of the most natural and stable forms of Vitamin C, this superfruit has a great source of antioxidants to help plump, brighten, and reduce the look of fine lines and wrinkles. Wildcrafted Buriti Oil: Native to Brazil, Buriti Oil is rich with vitamins that offer potent antioxidant defense. RMS Adaptogenic Herbal Blend: A proprietary blend of 9 adaptogenic herbs that help to balance, hydrate, soothe, and soften the skin.",,"Apply 2-3 drops to clean, damp skin as part of your morning and/or evening skincare regimen. Massage into face, neck and chest with gentle, circular motions. Use after cleansing as a nightly treatment or in the morning to hydrate and prep skin for makeup.","Balances skin, improves texture, preps for makeup, and delivers rich, radiant hydration. The original Beauty Oil you know and love has been reinvigorated with some of Rose-Marie’s most recent innovative, skin-loving ingredients like superfruit Kakadu Plum, the highest natural source of Vitamin C. With this light-but-super-concentrated blend of oils and proprietary adaptogenic herbs, skin has rich antioxidant defense, all day hydration, and glowing radiance.",https://contenthub-delivery.mecca.com/api/public/content/I-065828-I-065828-M1-RMSBeauty-KakaduBeautyOil-hn8We4dcSqe7gRwe5lKa3Q.webp?t=blur,https://www.mecca.com/en-au/rms-beauty/kakadu-beauty-oil-I-065828/?cgpath=skincare
1497,Dr. Dennis Gross,Pro Facial Steamer,$441.00,Skincare,Tools & Devices,,,In Stock,10.0,4.5,"Hydrating, Brightening, De-congesting, Soothing",,,"Fill the water tank with tap, purified or distilled water. After cleansing skin, turn on device with one press for warm and twice for hot. On the warm steam setting, the power button will glow light orange and for hot, the power button will glow hot pink. Steam for up to 15 minutes. Follow with the Alpha Beta Peel and Dr. Dennis Gross Skincare serum and moisturizer of your choice","An easy-to-use professional grade facial steamer with ultrasonic technology to infuse skin with deep hydration and help decongest pores for soft and dewy skin. Featuring two heat settings to accommodate skin sensitivity, this custom design utilizes a wide adjustable dual chamber nozzle to provide more steam output with a wider treatment area. Ultrasonic technology reduces the size of water molecules, creating a micro-steam to deeply hydrate and properly detox, balance, and prep the skin. Ideal for all skin types, especially those with dehydrated skin and enlarged pores, this device allows for more efficient exfoliation and enhances absorption of skincare products that follow. Leaves skin with an instantly hydrated, dewy, and smooth complexion.",https://contenthub-delivery.mecca.com/api/public/content/I-063675-I-063675-m1-dr-dennis-gross-pro-facial-steamer-KoIVWXpRVUe8otiql81jXw.webp?t=blur,https://www.mecca.com/en-au/dr-dennis-gross/pro-facial-steamer-I-063675/?cgpath=skincare
1510,bkr,Paris Water Balm,$30.00,Skincare,Lip Care,,,In Stock,,0.0,"Natural finish, Dewy finish, Sheer coverage, Hydrating, Brightening, Plumping",Mediterranean algae: collagen stimulating and increases production of hyaluronic acid. French rose: increases hydration. Paris essential biolipid complex: prevents moisture loss and plumps.,"Animal products, parabens, sulfates and gluten.",Apply onto lips using your finger or brush. Can be attached to your favourite BKR bottle.,"This glossy tint features a dazzling raspberry shade that will make you feel like you are wearing the most luxurious lip balm. The hydrating formula features rose, algae and essential biolipids and has a naturally delicious French rose scent. The unique design also allows you to easily connect this balm to your favourite BKR water bottle so you can hydrate internally and externally wherever you go.",https://contenthub-delivery.mecca.com/api/public/content/I-033603-I-033603-A1-BKR-ParisWaterBalm-tRAvfgoxXkKjXUV4duz4VQ.webp?t=blur,https://www.mecca.com/en-au/bkr/paris-water-balm-V-851763/?cgpath=skincare
1511,Goldfaden MD,Vital Boost,$46.00-$125.00,Skincare,Moisturisers,,,In Stock,53.0,4.4,"Cruelty-free, Vegan, Hydrating, Brightening, Exfoliating","Red tea extract: rich in natural antioxidants and enzymes such as vitamin C, E and carotene Hyaluronic acid: deeply hydrates and plumps Gooseberry extract: rich in vitamin C, brightens and improves skin tone Grapefruit: cleanses and tones whilst providing antioxidant protection","Silicones, gluten, mineral oil, parabens, alcohol","Apply on cleansed skin to face, neck and decollete on cleansed skin, with gentle upward motions. For optimal results, use daily.","This lightweight, daily moisturiser imparts skin with hydration and radiance whilst flooding it with antioxidants to help protect against free radical damage that can lead to premature ageing. The complexion is left looking dewy, radiant and flawless. Suitable for all skin types.",https://contenthub-delivery.mecca.com/api/public/content/I-021945-I-021945-M1-GoldfadenMD-VitalBoost-WCBRvmSArUWIG6z7G3gT6g.webp?t=blur,https://www.mecca.com/en-au/goldfaden-md/vital-boost-V-021945/?cgpath=skincare
1512,Kiehl's,Lip Balm #1 15ml,$24.00,Skincare,Lip Care,,15.0,In Stock,135.0,4.4,Hydrating,"Squalene: to help replenish the skin’s barrier, keeping it soft, supple and moisturised. Aloe Vera: to hydrate and soothe skin. Vitamin E: to moisturise and help neutralize skin-damaging free radicals.",Parabens and sulphates.,Apply liberally and allow an excess of the lip balm to be absorbed.,"A Kiehl's classic since the 1960's, this lip balm is a handbag must-have for soothed, nourished lips, 24/7. Formulated with squalene, aloe vera and vitamin E, the moisturising balm protects and relieves dry, chapped or cracked lips in the winter and throughout the year.",https://contenthub-delivery.mecca.com/api/public/content/I-041316-I-041316-M1-Kiehls-LipBalm1.webp?t=blur,https://www.mecca.com/en-au/kiehls/lip-balm-1-V-041316/?cgpath=skincare
1515,Susanne Kaufmann,Soothing Toner 100ml,$69.00,Skincare,Cleanser & Toner,,100.0,In Stock,5.0,4.8,"Cruelty-free, Hydrating, Soothing","Hyaluronic acid: effectively binds moisture, prevents moisture loss and improves the natural elasticity and firmness of the skin. Mallow extract: protects against environmental stressors, moisturises and soothes irritation and redness. Mallow root extract: forms a protective and moisturising layer on the skin and provides soothing benefits. Yarrow extract: contains ample amounts of vitamin A, known as a natural retinol. It helps to increase enzyme activity and stimulates collagen production.","Parabens, silicones, phthalates and sulfates.","After cleansing, saturate a face pad and sweep over the face, neck and décolletage to remove any last traces of make-up or dirt.","A refreshing, gentle toner developed to balance and regenerate the skin, restoring its natural pH level and protecting against environmental stress throughout the day. Featuring a blend of chamomile, yarrow and mallow extracts, to soothe and nourish dry skin by replacing lost moisture. A complex of burdock root extract, known for its antiseptic properties, St. John’s wort and sage leaf extracts clears and energises the skin. Botanical hyaluronic acid meanwhile deeply moisturises and plumps the skin leaving it hydrated and beautifully prepared for subsequent skincare. Suitable for all skin types, particularly those prone to dryness and sensitivity.",https://contenthub-delivery.mecca.com/api/public/content/I-056637-I-056637-M1-SusanneKaufman-SoothingToner-iI7VgWlTMk6GaAy0SIhwQ.webp?t=blur,https://www.mecca.com/en-au/susanne-kaufmann/soothing-toner-I-056637/?cgpath=skincare
