Product Number,Brand,Product Name,Price,Category,Subcategory,Weight (g),Weight (ml),Stock Status,Review Count,Rating,Benefits,Key Ingredients,Made Without,Usage,Ingredients,Hero Image,Link
1,MECCA COSMETICA,Gel Cream 50ml,$55.00,Skincare,Moisturisers,,50.0,In Stock,95.0,4.4,"Anti-blemish, Hydrating, Brightening, De-congesting, Exfoliating, Smoothing, Anti-shine, Oil free",Squalane: Replenishes moisture levels​. Niacinamide: Helps minimise oil. Amino Acid Complex: Refines the appearance of pores.,"Fragrance, Parabens, Oil, Sulphates (SLS & SLES).",Massage into clean skin in the morning and evening.,"The formula: This oil-free, fragrance-free gel cream contains Squalane to replenish the skin’s moisture levels, whilst Niacinamide works to control oil, and Amino Acid Complex helps refine the appearance of pores.",https://contenthub-delivery.mecca.com/api/public/content/I-072674-I-072674-M1-MeccaCosmetica-GelCream-dPiXXtGFQXK0JeE1cGgW8g.webp?t=blur,https://www.mecca.com/en-au/mecca-cosmetica/gel-cream-I-072674/?cgpath=skincare
2,Summer Fridays,Lip Butter Balm,$39.00,Skincare,Lip Care,,,In Stock,255.0,4.3,"Cruelty-free, Vegan, Hydrating","Shea & murumuru seed butters: moisturisers that soothe, heal and condition parched lips. Plant-derived compounds: leave lips feeling smooth. Plant waxes: soften lips and boost shine. Sodium hyaluronate: seals in moisture creating a plush, deeply hydrated pout.","Parabens, synthetic dyes, sulphates and petroleum.","Use when your lips need some extra hydration throughout the day—or as a nourishing overnight mask. For external use only. Keep out of reach of children. Avoid getting into eyes. If eye contact occurs, flush thoroughly with water. If irritation persists, contact a physician.","This vegan, conditioning cream-oil lip mask soothes and hydrates parched lips in seconds. Formulated with rich plant derived butters, this silky formula melts into dry cracked lips, for instant hydration while creating a flexible barrier to seal in moisture.",https://contenthub-delivery.mecca.com/api/public/content/I-066238-I-066238-M1-SummerFridays-LipButterBalmBirthdayCake-1eqEeerqTtK1U8HIw0bKQ.webp?t=blur,https://www.mecca.com/en-au/summer-fridays/lip-butter-balm-V-066238/?cgpath=skincare
3,Dr. Dennis Gross,DermInfusions™ Fill + Repair Eye Cream 15ml,$118.00,Skincare,Eye Care,,15.0,In Stock,,0.0,"Cruelty-free, Vegan, Hydrating, Brightening, Firming, Plumping, Alcohol-free","Hyaluronic Acid: Hydrates and plumps to reduce the appearance of fine lines. Copper Peptides: Reduces dark circles and puffiness while improving skin elasticity. Kakadu Plum: Antioxidant that firms, brightens, and hydrates. Ectoin & Bisabolol: Deeply hydrates and helps lock in moisture for a healthier barrier.",,"For AM or PM use. To apply, use finger to gently tap around the full 360 eye area. Start with gently applying under the eyes moving out towards the corners where crow's feet can form, around onto the eyelid, down the elevens, ensuring you bring the product down to where bunny lines can form.","An ultra-hydrating eye cream with clinically proven, 360° results targeting six zones — crow's feet, under eyes, lids, bunny lines, elevens, and the inner tear trough— to visibly fill, firm, brighten, smooth, and lift.",https://contenthub-delivery.mecca.com/api/public/content/I-075915-I-075915-M1-DrDennisGross-DermInfusionsFillAndRepairEyeCream-MrJe1MWTQQCTPny4TJXpvw.webp?t=blur,https://www.mecca.com/en-au/dr-dennis-gross/derminfusions-fill-repair-eye-cream-I-075915/?cgpath=skincare
4,Youth To The People,Superfood Cleanser,$24.00-$67.00,Skincare,Cleanser & Toner,,,In Stock,3952.0,4.8,"Cruelty-free, Vegan, Anti-blemish, Hydrating, Brightening",Kale:  This leafy veg is a must-have for more than just your morning juice. It's rich in skin-loving phytonutrients and vitamins C and E. Spinach:  A lightweight skin-soother that boasts a high natural moisture content and cooling properties. Green Tea:  Antioxidant-rich powerhouse helps combat free radicals.,Parabens.,Massage onto wet skin for at least 30 seconds. Rinse thoroughly. Use Superfruit Cleanser as a treatment at least 3x a week as a complement to your daily Superfood Cleanser routine or depending on your current skincare routine.,"The powerful, but gentle daily face wash is formulated with superfood antioxidants from kale, spinach, and green tea - to give your skin the ultimate cleanse. It works effectively to prevent buildup in pores, remove makeup, and balance pH without drying or stripping. This is the green juice cleanse for your face. Made with cold-pressed antioxidants to remove makeup, prevent buildup in pores, and support skin’s pH balance.",https://contenthub-delivery.mecca.com/api/public/content/I-076842-I-076842-M1-YouthToThePeople-SuperfoodCleanser-5wE3OaNnSxuHpxz9L72sDQ.webp?t=blur,https://www.mecca.com/en-au/youth-to-the-people/superfood-cleanser-V-076841/?cgpath=skincare
5,Tower 28,SOS Daily Balancing Gel Cleanser 150ml,$33.00,Skincare,Cleanser & Toner,,150.0,In Stock,286.0,4.7,"Cruelty-free, Vegan, Hydrating, Brightening, Fragrance-free","Minerals & Electrolytes (Zinc, Copper, Magnesium): Help build skin's immunity & boost hydration levels. 100% Pure Aloe Vera: Helps form a protective barrier to retain moisture & promote healing. Oat Extract: Helps naturally soothe inflammation & irritation.","Fragrance, Parabens, Silicones, Sulfates, Essential Oils, Foaming Agents.","Use twice daily, AM/PM. For the best skin-soothing results, follow with SOS Spray and SOS Cream.","This non-stripping cleanser takes it all off while building the skin's barrier back up. Designed to help naturally soothe inflammation with 100% pure aloe vera and oat extract, it also works to replenish the skin with essential minerals and electrolytes normally stripped during cleansing. Gentle enough for daily AM/PM use, this soap-free, fragrance-free, pH-balanced gel is clinically-tested, derm-approved, and won't itch, sting, or burn.",https://contenthub-delivery.mecca.com/api/public/content/I-069421-I-069421-M1-Tower28-SOSDailyBalancingGelCleanser-8dh8V0xgQfFC3AVt5Fuw.webp?t=blur,https://www.mecca.com/en-au/tower-28/sos-daily-balancing-gel-cleanser-I-069421/?cgpath=skincare
6,ELEMIS,Pro-Collagen Cleansing Balm,$29.00-$105.00,Skincare,Cleanser & Toner,,,In Stock,110.0,4.4,"Cruelty-free, Hydrating, Brightening, Smoothing","Elderberry Oil Contains high levels of essential Fatty Acids and other micronutrients that are key to keeping skin healthy. Starflower Oil Grown and pressed in the UK, this oil is the richest natural source of Gamma Linolenic Acid, which promotes good skin health by helping to maintain skin metabolism. Padina Pavonica A brown algae found on the Mediterranean coast that is known to support the feeling of hydration.","ELEMIS formulas undergo independent third-party consumer and clinical testing to ensure efficacy and safety of each product. We have a strict product ethos, banning 2000+ potentially harmful ingredients that can cause unnecessary irritation and dryness, including: Aluminium, Artificial dyes, DEA, Formaldehyde, Hydroquinone, Mineral oils, Parabens, Phthalates, SLS/ SLES, and Talc. Formulated Safely, Without Risk.","Use daily morning and evening as a cleanser or weekly as a nourishing facial mask. Step 1 Warm an almond-sized amount between palms and then massage the balm over face, neck and décolleté with light circular massage movements. The balm will melt into a cleansing oil. Step 2 Moisten fingertips and continue to massage to emulsify the oil into a hydrating milk. Step 3 Remove with a warm, damp cleansing cloth. To Use as a Nourishing Facial Mask Warm an almond-sized amount between palms and then massage the balm over face, neck and décolleté with light circular massage movements. Leave the balm on the face for 10 minutes before removing with a warm wash cloth.",Experience the ultimate cleansing experience with our award-winning icon – the essential first step in your daily skincare ritual.,https://contenthub-delivery.mecca.com/api/public/content/I-049419-I-049419-M1-Elemis-ProCollagenNakedCleansingBalm-WfFoNmR9XUaaFwRzH5lc3w.webp?t=blur,https://www.mecca.com/en-au/elemis/pro-collagen-cleansing-balm-V-851286/?cgpath=skincare
7,Youth To The People,Superfood Air-Whip Moisture Cream,$28.00-$88.00,Skincare,Moisturisers,,,In Stock,,0.0,"Cruelty-free, Vegan, Hydrating, Brightening, Firming, Plumping",Kale: Rich in phytonutrients and vitamins C and E to leave skin visibly glowing. Hyaluronic Acid: A natural hydrator known for its incredible moisture-retaining properties. Green Tea: Antioxidant-rich powerhouse that fights visible signs of aging.,,Apply to face and neck after cleansing day and night.,"This lightweight face cream floods skin with vital hydrating ingredients for long-lasting moisture that's never heavy or greasy. Superfood and vitamin-rich, it cools and comforts skin, leaving a healthy, natural glow. Suitable for blemish-prone skin, won't clog pores, and layers well with makeup. A lightweight gel moisturizer that visibly plumps, provides up to 48 hours of hydration^, and helps strengthen the moisture barrier in one hour^.​",https://contenthub-delivery.mecca.com/api/public/content/I-076845-I-076845-M1-YouthToThePeople-SuperfoodAirWhipMoistureCream-dq7whj7CTXmzvfAQZESZNw.webp?t=blur,https://www.mecca.com/en-au/youth-to-the-people/superfood-air-whip-moisture-cream-V-076845/?cgpath=skincare
8,MECCA COSMETICA,To Save Face SPF50+ Matte Sun Serum 50mL,$50.00,Skincare,Sun Protection,,50.0,In Stock,10.0,4.3,,White Willow Bark helps control shine and reduce the appearance of pores. Gluconolactone gently exfoliates for a smooth skin texture.,,"Smooth a generous amount of lotion evenly over dry skin at least 20 minutes prior to sun exposure. Leave to dry for 3 minutes after application to optimise the matte finish, particularly before applying makeup. Reapply every 2 hours and more often after swimming, sweating, or toweling.","Sun care meets skincare in this SPF50+ lightweight sun serum. White Willow Bark helps control shine and reduce the appearance of pores, Gluconolactone helps skin texture appear smoother. Once applied, this non-comedogenic formula leaves skin matte, without clogging pores or leaving a greasy residue.",https://contenthub-delivery.mecca.com/api/public/content/I-070609-I-070609-M1-MeccaCosmetica-SunSerumMatte-4NqSI7xQGaXUUcboDCukQ.webp?t=blur,https://www.mecca.com/en-au/mecca-cosmetica/to-save-face-spf50-matte-sun-serum-I-070609/?cgpath=skincare
9,Tatcha,The Dewy Skin Cream,$38.00-$118.00,Skincare,Moisturisers,,,In Stock,230.0,4.2,"Hydrating, Brightening",Japanese purple rice bran: rich in antioxidants to help the skin recover from and shield itself against harsh external aggressors and stress. Okinawa algae blend: supports the production of hyaluronic acid and ceramides to improve the skin’s barrier functions for optimal moisture retention. Squalane: maintains skins moisture barrier and hydration levels.,"Mineral oil, synthetic fragrances, sulphate detergents, parabens, urea, DEA, TEA and phthalates.","Using the golden spoon, scoop out one to two spoonfuls of cream and gently massage into cleansed skin using upward motions. Use morning and night.","A rich, luxurious cream that intensely hydrates the skin, delivering a healthy, youthful glow in an instant. Best suited to those concerned about dryness, uneven texture and loss of elasticity. Tatcha’s signature Hadasei-3 blend of anti-ageing Japanese superfoods, green tea, rice and algae, delivers essential nutrients for optimal skin health and youthful radiance.",https://contenthub-delivery.mecca.com/api/public/content/I-036500-I-036500-M1-Tatcha-TheDewySkinCream-urPUoGQUqkyollcVAW4IA.webp?t=blur,https://www.mecca.com/en-au/tatcha/the-dewy-skin-cream-V-852370/?cgpath=skincare
10,Clinique,Take the Day Off Cleansing Balm,$30.00-$102.00,Skincare,Cleanser & Toner,,,In Stock,2102.0,4.7,Hydrating,"Safflower seed oil: removes dirt and oil from the skin whilst moisturising and enhancing radiance. Vitamin E: chief skin soother and hydrator, this key ingredient smooths the skin, reduces redness and minimises the appearance of scars.","Parabens, phthalates and fragrance.","Gently scoop out a small amount of product, smooth over skin and eyes and massage in with circular motions. Using warm water and a muslin cloth, gently rub off. Always follow with a foaming cleanser to kick start the rest of your skincare routine. Use day and night.","Dissolve away even the most stubborn waterproof mascara with this luscious balmtooil cleanser. The lightweight, makeupremoving formula instantly transforms from a solid balm to oil upon contact with the skin. It easily melts away eye and face makeup, including sunscreen, without leaving behind a greasy residue nor dehydrating the skin. Skinloving ingredients work to nourish while you cleanse. Add a gentle exfoliating kick by using a muslin cloth.",https://contenthub-delivery.mecca.com/api/public/content/I-024143-i-024143-m1-clinique-take-the-day-off-cleansing-balm-1-940-x2iN9nZS7kqTFNdj3UYNHA.webp?t=blur,https://www.mecca.com/en-au/clinique/take-the-day-off-cleansing-balm-V-024143/?cgpath=skincare
11,Korres,Greek Yoghurt Foaming Cream Cleanser | Pre + Probiotics 150mL,$38.00,Skincare,Cleanser & Toner,,150.0,In Stock,472.0,4.8,Hydrating,Greek Yoghurt: delivers a soother SuperDose of pre and probiotic extracts to nourish skin. Amaranth seed extract + milk proteins: provide soothing hydration and comfort to the skin.,Parabens and sulfates.,Rub gently into skin and rinse with plenty of water.,"The one and only indulgent soap-free, cream-to-foam cleanser, formulated with the ancient skin-soothing superfood, Greek Yoghurt. One-step that gently and effectively removed impurities and make-up without irritating.",https://contenthub-delivery.mecca.com/api/public/content/I-056981-I-056981-M1-Korres-GreekYoghurtFoamingFaceCleansing-azJa5E1SAysx4pYxcNtBQ.webp?t=blur,https://www.mecca.com/en-au/korres/greek-yoghurt-foaming-cream-cleanser-pre-probiotics-150ml-I-056981/?cgpath=skincare
12,Dr. Dennis Gross,Alpha Beta® Universal Daily  Peel,$32.00-$251.00,Skincare,Treatment,,,In Stock,54.0,4.6,"Anti-blemish, Brightening, De-congesting, Exfoliating, Evens Skin Tone, Smoothing","Step 1 5 Alpha Beta® acids: Lift away dead skin cells, while toning and smoothing skin. Chamomile: Has anti-inflammatory properties that helps neutralize and soothe skin. Step 2 Retinol: Helps smooth wrinkles and lines while increasing moisture & elasticity. Green Tea Extract: A natural antioxidant that protects skin from free radicals and environmental toxins.","Parabens, sulfates, phthalate.","For optimal results, use daily AM or PM. First time peel users may apply every other day until skin becomes acclimated. Massage Step 1 onto clean, dry skin until pad is dry. Wait two minutes. Repeat with Step 2. To further enhance results, follow with a serum and moisturizer of your choice from Dr. Dennis Gross Skincare™.","The effective dose of 5 AHA/BHAs plus antioxidants and vitamins lift away dead skin along with excess oil & impurities, while improving uneven tone & texture. 2 minutes to smooth, beautiful skin. Experience immediate radiance and see beautifully transformed skin with regular use: your pores look smaller, lines fade, and your skin looks more even and balanced. The rest of your skincare absorbs faster and makeup goes on better for ageless looking skin.",https://contenthub-delivery.mecca.com/api/public/content/I-052382-I-052382-M1-Dr.DennisGross-AlphaBetaUniversalPeelDaily-hH7fcVgpUKEzRCrKqZgg.webp?t=blur,https://www.mecca.com/en-au/dr-dennis-gross/alpha-beta-universal-daily-peel-V-052382/?cgpath=skincare
13,Allies of Skin,Molecular Barrier Recovery Cream Balm 48ml,$156.00,Skincare,Treatment,,48.0,In Stock,,0.0,"Hydrating, Brightening, Firming, Soothing","2% MOSSCELLTEC™ Award-winning natural adaptogen. Promotes skin barrier recovery, strengthens skin against urban aggressors, improves hydration and barrier recovery in just two weeks.* OAT PROTEIN & ATP A protein and an organic compound that together help strengthen the skin's barrier function and promote skin recovery for overall smoothness and plumpness.** CERAMIDE Helps promote moisture retention, prevent dryness and irritation, and reinforce the skin barrier for enhanced resilience and bounce.","Silicones, Sulfates, Denatured Alcohol, Synthetic Dyes, Added Fragrance or Essential Oils.","Keep the skin barrier protected, healthy, and strong. Perfect for AM/PM use. Apply 2-4 pumps to dampened face, eye area, and neck. Always remember to wear SPF the next day.","A daily leave-on treatment from Allies of Skin is supercharged with award-winning adaptogen 2% MossCellTec™, Oat Protein & ATP, Panthenol, Black Cumin Oil, Palmitoyl Tripeptide-8, Ceramide and Niacinamide, that helps soothe and repair compromised and post-procedure skin.",https://contenthub-delivery.mecca.com/api/public/content/I-066524-I-066524-M1-AlliesOfSkin-MolecularBarrierRecoveryCreamBalm-zhnup3PRRYG1K0sXsmJJVw.webp?t=blur,https://www.mecca.com/en-au/allies-of-skin/molecular-barrier-recovery-cream-balm-I-066524/?cgpath=skincare
15,Youth To The People,15% Vitamin C + Caffeine Energy Serum 30ml,$118.00,Skincare,Treatment,,30.0,In Stock,1.0,5.0,"Cruelty-free, Vegan, Hydrating, Brightening, Firming, Evens Skin Tone, Fragrance-free","15% Vitamin C Complex: Three powerful sources of Vitamin C are combined in our pro-grade formula - Ethyl Ascorbic Acid, Tetrahexyldecyl Ascorbate (THD Ascorbate), and Magnesium Ascorbyl Phosphate - for maximum efficacy and stability. Yerba Mate + Guayusa: Naturally high in caffeine, this superleaf-derived extract enhances microcirculation to reduce morning puffiness. Passion Fruit: High in antioxidants, helps scavenge for free radicals. Dragon Fruit: Promotes skin health and replenishes essential moisture. Squalane: An emollient that provides weightless hydration, locking in moisture.","Added fragrance, parabens.","In the morning, apply 1-2 pumps to cleansed face and neck. Follow with Superfood Air-Whip Moisture Cream or Adaptogen Deep Moisture Cream. With daily use, this super dose of antioxidants helps reduce the look of hyperpigmentation, even skin tone, and visibly firm.","A 15% vitamin C serum is boosted with plant-derived caffeine from superleafs yerba mate and guayusa to brighten, reduce morning puffiness, and hydrate.",https://contenthub-delivery.mecca.com/api/public/content/I-076855-I-076855-M1-YouthToThePeople-15VitaminCCaffeineEnergySerum-5O6GJ2cqRMmiUUCNmew.webp?t=blur,https://www.mecca.com/en-au/youth-to-the-people/15-vitamin-c-caffeine-energy-serum-I-076855/?cgpath=skincare
17,Emma Lewisham,Skin Reset Serum,$50.00-$148.00,Skincare,Treatment,,,In Stock,166.0,4.2,"Vegan, Hydrating, Brightening, Exfoliating, Firming","Developed by physiologists for the complex physiology of your skin, Emma Lewisham’s Physiology Synchrony Unlock (PSU) Method™ mirrors the way the skin works by blending up to 25 ingredients that trigger synergistic action across multiple points of the skin. These ingredients include: Niacinamide – powerfully brightens the skin and reduces the transfer of melanin to the skin surface. Advanced bioavailable Vitamin C - reduces melanin production by inhibiting the tyrosinase enzyme. Ergothioneine - restores Vitamin C to its active state on the skin, ‘recharging’ it for extended action. Glycerin - replenishes and restores the skin by drawing and absorbing water from the air, thus helping the skin retain moisture.",Parabens and sulfates.,"- Use AM and/or PM. After cleansing and before your moisturiser - Apply 1–2 pumps into your hands - Warm between your fingers and gently press into your face and neck (targeting areas with dark spots, pigmentation or uneven tone) - Follow up with a moisturiser or face oil and SPF in the morning",Why this is good for you…,https://contenthub-delivery.mecca.com/api/public/content/I-057706-I-057706-M1-EmmaLewisham-SkinResetFaceSerum-9xcYYLKd1kWN4EwdeQvgDQ.webp?t=blur,https://www.mecca.com/en-au/emma-lewisham/skin-reset-serum-V-057706/?cgpath=skincare
18,Eve Lom,Heritage Cleanser 100ml,$144.00,Skincare,Cleanser & Toner,,100.0,In Stock,,0.0,"Hydrating, De-congesting, Exfoliating, Smoothing, Fragrance-free","Clove oil: Stimulates blood flow and rejuvenates dull, dry skin. Eucalyptus Oil: Anti-inflammatory, soothing, and smoothing. Hops Oil: Antioxidant rich, softens and conditions. Egyptian Chamomile Oil: Powerful anti-inflammatory properties. Cocoa Butter: Rich emollient high in fatty acids.","Synthetic fragrance, Synthetic Colourants, Parabens, Sulphates, SLS/SLES.","Scoop up a small amount of Cleanser and warm it between fingers before massaging it on dry skin, in circular motions. To rinse, wet the EVE LOM 100% Muslin Cloth in hot water and buff off, focusing on any areas of concern (like, dryness, congestion, or heavy make-up). Rinse cloth and repeat a second and third time before finishing with a cold compress using the cloth and cold water.","For 40 years, the EVE LOM Cleanser has transformed the way we cleanse — elevating skincare from a routine to a ritual. A formula revered for its multi-benefit efficacy, it continues to set the standard for cleansing, combining indulgence with proven results.",https://contenthub-delivery.mecca.com/api/public/content/I-076504-I-076504-M1-EveLom-HeritageCleanser-cuopGce2QxK2V8bpodNtYQ.webp?t=blur,https://www.mecca.com/en-au/eve-lom/heritage-cleanser-I-076504/?cgpath=skincare
19,Glow Recipe,Watermelon Glow Niacinamide Dew Drops™,$33.00-$57.00,Skincare,Treatment,,,In Stock,1917.0,4.7,"Cruelty-free, Vegan, Brightening, Alcohol-free","Niacinamide (Vitamin B3): helps brighten dullness, even out skin tone, minimize pores, improve barrier function, and soften the look of fine lines and wrinkles. Watermelon: hydrates, delivers essential vitamins and amino acids, and helps to brighten skin. Hyaluronic acid: keeps skin hydrated and bouncy, and retains 1000 times its weight in water to breathe new life into skin.","Parabens, formaldehydes, formaldehyde-releasing agents, phthalates, mineral oil, retinyl palmitate, oxybenzone, coal tar, hydroquinone, sulphates sls & sles, synthetic fragrance (less than 1%), triclosan.","For use as a brightening serum: Apply 1 pump before moisturiser to get long-lasting, glowing skin results. As a priming step: Apply 1–2 pumps as the last step in your skin-care routine before makeup. For maximum glow: On a no-makeup day, apply 1–2 pumps as the last step of your entire routine.","A multi-use highlighting face serum that gives skin the ultimate dewy glow without the use of glitter, pearls or mica. This lightweight gel can be used as a hydrating, brightening and highlighting serum. Suitable for all skin types, use this versatile product before moisturiser or as the last step in your beauty routine for an instant glossy finish. This product has been ophthalmologist tested.",https://contenthub-delivery.mecca.com/api/public/content/I-047284-I-047284-M1-GlowRecipe-WatermelonGlowNiacinamideDewDrops-GVo5HqwTIkWaFTYZzbV4mw.webp?t=blur,https://www.mecca.com/en-au/glow-recipe/watermelon-glow-niacinamide-dew-drops-V-047284/?cgpath=skincare
20,Summer Fridays,Jet Lag Mask,$43.00-$80.00,Skincare,Treatment,,,In Stock,107.0,3.8,"Vegan, Hydrating, Brightening, Soothing, Fragrance-free","Niacinamide: a multifaceted compound of vitamin B3, which helps reduce the appearance of fine lines and pores — to create brighter, more even skin tone and texture. Glycerin: this super-powered humectant attracts and locks in moisture, providing lasting dryness relief that helps skin feel soft and supple. Hyaluronic acid: a moisture magnet helps draw hydration into the skin for a firm, plump look, and healthy glow. Skin-soothing blend: a calming cocktail of allantoin, bisabolol, panthenol and cucumber extract helps to comfort stressed skin.","Fragrance, essential oils, parabens, formaldehydes, formaldehyde-releasing agents, phthalates, mineral oil, retinyl palmitate, oxybenzone, coal tar, hydroquinone, sulfates sls & sles, triclocarban, triclosan.","*Before applying we recommend to patch test to determine suitability. Discontinue use if rash or irritation appears. On cleansed, dry skin apply a thin, even layer with fingertips. May be used under and over the eye area. Leave for 10 minutes for maximum hydration. Blot with a warm cloth or tissue if necessary—no need to rinse. Warning: For adult external use only.","A vegan, hydrating and fragrance-free face mask reformulated to help nourish and soothe skin. The enhanced formula features niacinamide to balance and calm, glycerin and hyaluronic acid to plump, plus antioxidants to help promote healthier looking skin. This multi-tasking mask can be used as a daytime moisturiser, face mask or even an in-flight skin saviour.",https://contenthub-delivery.mecca.com/api/public/content/I-050675-I-050675-M1-SummerFridays-JetLagMask-B55CApVu70WPsCdCuRwzfw.webp?t=blur,https://www.mecca.com/en-au/summer-fridays/jet-lag-mask-V-050675/?cgpath=skincare
