Product Number,Brand,Product Name,Price,Category,Subcategory,Weight (g),Weight (ml),Stock Status,Review Count,Rating,Benefits,Key Ingredients,Made Without,Usage,Ingredients,Hero Image,Link
869,Horace,Salicylic Acid + Niacinamide Serum 30ml,$38.00,Skincare,Treatment,,30.0,Out of Stock,8.0,4.6,"Anti-blemish, De-congesting, Anti-shine, Soothing, Fragrance-free",Salicylic acid (BHA) Niacinamide A by-product of zinc Vitamin C Glycerin,"Silicones, parabens and mineral oils.","To use everyday, morning and/or night. Apply onto clear and dry skin, before moisturizing. Pour 3 drops in your hands, using the pipette, and massage the face. Apply your moisturizer without rinsing off the serum.",This Salicylic Acid + Niacinamide Serum visibly reduces and prevents the appearance of blemishes and tightens pores.,https://contenthub-delivery.mecca.com/api/public/content/I-063583-I-063583-m1-horace-serum-salic-acid-niacin-8UUJHu0tUacSvX3ib4Rmg.webp?t=blur,https://www.mecca.com/en-au/horace/salicylic-acid-niacinamide-serum-I-063583/?cgpath=skincare
872,Omorovicza,Refining Facial Polisher 100ml,$150.00,Skincare,Treatment,,100.0,Out of Stock,404.0,4.8,Exfoliating,"Hungarian moor mud: contains calcium and magnesium carbonates, humic acid and fulvic acid, which work together to purify and nourish the skin. Pumice: sloughs off dead skin cells and accelerates cell turnover. Lactobionic acids: refines the complexion without irritating the skin. Copper gluconate: purifies the skin by acting as an astringent and regulator of sebum production. Patented Healing Concentrate: leaves skin firmer, suppler and more youthful in appearance.","Animal products, parabens, sulphates, phthalates, silicones,","Apply and massage in a circular motion from the nose area outward. As you buff, the polisher will turn from emerald green to pearlescent grey, revealing the Moor mud. Leave on for 2 minutes then rinse thoroughly with warm water. Finish with the application of a serum or moisturiser.","The Refining Facial Polisher harnesses the power of transformative Hungarian moor mud, rich in calcium and magnesium, to draw out impurities. Enriched with marine micro-algae, to refine skin texture and brighten tone, while natural pumice frees skin of flakiness and roughness.",https://contenthub-delivery.mecca.com/api/public/content/I-020160-I-020160-M1-Omorovicza-RefiningFacialPolisher-1-t0whNCZ5RUOUXoK9NDCRqQ.webp?t=blur,https://www.mecca.com/en-au/omorovicza/refining-facial-polisher-I-020160/?cgpath=skincare
882,Anastasia Beverly Hills,Brow Genius Serum 3.5ml,$98.00,Skincare,Eye Care,,5.0,In Stock,25.0,4.2,Fragrance-free,"Peptide: formulated with Red Clover Extract, it helps to encourage the appearance of fuller looking brows and protect against breakage. Korean Red Ginseng: helps to make brow hair appear thicker. Panthenol: helps to smooth, soften and tame coarse or wiry texture for easier styling and manageability. Biotin: helps to coat the hair to create fuller looking strands. Castor Oil: helps to protect, nourish and condition brow hair and create a healthy environment on skin and around the exterior of the follicle.","Parabens, phthalates, mineral oil, sulphates, fragrance, silicones.","Apply directly to clean brows, focusing on sparse areas. Use short, hair-like strokes starting at the root and working in the direction of hair growth. Allow the formula one to two minutes to dry before grooming and styling your brows. Apply every day in the morning and night for a minimum of 8 weeks for optimal results. Brow Genius requires continued use to maintain benefits.","A multi-benefit brow serum that noticeably improves texture, manageability and encourages the appearance of fuller-looking brows. Brow Genius® blends 6 rejuvenating ingredients into a multi-benefit, brilliant formula that is designed to create smoother, softer, tamer, fuller-looking brows that feel and perform like the brows you have always wanted. From peptides, panthenol and Korean ginseng to biotin and castor oil, this power roster of ingredients is designed to nourish brows, increase manageability and deliver the ultimate brow makeover.",https://contenthub-delivery.mecca.com/api/public/content/I-056053-I-056053-M1-AnastasiaBeverlyHills-BrowGeniusSerum-UoKOxHaRUeBwziXxpVw1A.webp?t=blur,https://www.mecca.com/en-au/anastasia-beverly-hills/brow-genius-serum-I-056053/?cgpath=skincare
889,M·A·C Cosmetics,Hyper Real Skincanvas Balm,$44.00-$87.00,Skincare,Moisturisers,,,In Stock,6.0,4.2,Hydrating,"Resilient and rare Japanese Peony Extract: strengthens skin’s barrier and visibly improves skin’s radiance and translucency by evening skin tone over time, delivering health-looking, naturally glowing skin. 2.5% Skin-refining Niacinamide: helps to increase cell turnover, gently refining skin texture and reducing the appearance of dullness, fine lines and wrinkles over time. Hydrating and plumping Hyaluronic Acid: delivers a burst of rejuvenating moisture. Restorative Ceramides: protects the skin’s barrier and aids in moisture retention. Mango and Avocado Butter: helps to leave skin feeling soft, nourished and conditioned.","- Apply twice a day, morning and evening, as part of your Hyper Real™ skincare routine. - Place desired amount of product directly onto fingertips to apply evenly onto freshly cleansed skin. - Use our Artist-crafted Massage-Melt Technique to apply the formula by gently massaging it into skin using circular motions. - Avoid eye area.",,"Indulge your skin with M.A.C.'s science-backed and Artist-approved moisturising facial cream that deeply hydrates and smooths skin immediately and over time. The lightweight, fast-absorbing cream strengthens and protects the skin barrier for overall healthier-looking skin. It soothes and prevents against visible irritation, and moisturizes for 24 hours to reveal supple, petal-soft skin with a healthy-looking glow. The high-performance moisturiser is powered by our Pro-4 Power Infusion Matrix™ that features resilient and rare Japanese Peony Extract, 2.5% skin-refining Niacinamide, hydrating and plumping Hyaluronic Acid, and restorative Ceramides to deliver immediate and long-lasting results. Additionally, Mango and Avocado Butters help to leave skin feeling soft, nourished and conditioned. Tested on all skin tones. Wear alone or underneath makeup for a perfectly prepped, makeup-ready complexion.",https://contenthub-delivery.mecca.com/api/public/content/I-058662-I-058662-M1-MACCosmetics-HyperRealSkinCanvasBalm-VVJQopuB40aZmlXmhHPatA.webp?t=blur,https://www.mecca.com/en-au/mac-cosmetics/hyper-real-skincanvas-balm-V-058662/?cgpath=skincare
892,TULA,The Cult Classic Purifying Face Cleanser,$23.00-$56.00,Skincare,Cleanser & Toner,,,In Stock,16.0,3.6,"Hydrating, Brightening, Exfoliating, Smoothing, Alcohol-free","Probiotic Extracts: help maintain skin balance Prebiotics (Chicory Root): help nourish skin Turmeric, White Tea & Blueberry: help improve skin texture.","Parabens, sulfates, phthalates, mineral oil & petrolatum, formaldehyde, formaldehyde releasing preservatives, triclosan, retinol, gluten, silicone, dimethicone.","Massage a small amount of the cleanser onto wet skin and rinse with water. Use twice daily, AM and PM.","Remove dirt, impurities and makeup without stripping or drying skin with this gel-based cleanser. Packed with prebiotics, probiotic extracts and turmeric, this refreshing formula leaves skin purified, clarified and balanced.",https://contenthub-delivery.mecca.com/api/public/content/I-053949-I-053949-M1-Tula-CultClassicCleanser-W6zxT2QXCkKiI8khGVmCMQ.webp?t=blur,https://www.mecca.com/en-au/tula/the-cult-classic-purifying-face-cleanser-V-053940/?cgpath=skincare
893,GOOP,GOOPGLOW Microderm Instant Glow Exfoliator,$69.00-$205.00,Skincare,Treatment,,,In Stock,39.0,4.6,"Brightening, Exfoliating","Micro-exfoliating minerals (quartz, garnet, alumina, silica): to instantly polish and buff dead, dull, dry skin. Glycolic acid (AHA): the gold standard in chemical exfoliation to remove dead skin and increase cell turnover. Australian Kakadu plum: helps improve skin luminosity (with 100 times more vitamin C than an orange).","Parabens, petroleum, phthalates, SLS, SLES, PEGs, TEA, DEA, silicones, artificial dyes or fragrances.","Massage onto clean, damp skin using circular motions. Rinse off with warm water or leave on for two to three minutes. Pat dry. Use two to three times a week. Caution: For external use only. Avoid contact with eyes. If irritation persists or allergic reaction occurs, rinse off immediately, discontinue use, and consult a physician. Keep out of reach of children. Sunburn alert: This product contains an alpha hydroxy acid (AHA) that may increase your skin’s sensitivity to the sun and particularly the possibility of sunburn. Use sunscreen, wear protective clothing, and limit sun exposure while using this product and for a week afterward.","Enjoy a physical and chemical exfoliation when you dip into this air-whipped dual-action microdermabrasion treatment. Designed to polish skin, smooth uneven texture, and reveal a healthy-looking, glowing complexion, the formula is densely packed with a blend of four powerful micro-exfoliating minerals (quartz, garnet, alumina, and silica). Rounding out this mix, glycolic acid has been included to help sweep away dry, dead skin cells and refine the appearance of pores for skin that is visibly softer, smoother, and more radiant.",https://contenthub-delivery.mecca.com/api/public/content/I-047484-I-047483-M1-Goop-GoopGlowMicrodermInstantGlowExfoliator-w3Sr2xuHEyRfNfAiX74sA.webp?t=blur,https://www.mecca.com/en-au/goop/goopglow-microderm-instant-glow-exfoliator-V-047483/?cgpath=skincare
894,Skinstitut,Vitamin C Ceramide Moisturiser 50ml,$68.00,Skincare,Moisturisers,,50.0,In Stock,2.0,5.0,"Hydrating, Brightening, Smoothing","Vitamin C​: An encapsulated ascorbyl glucoside designed to be more stable than other forms of Vitamin C which makes it a great choice for sensitive skin. This gentle form of Vitamin C helps provide antioxidant protection to the skin while delivering transformative effects for radiance and texture, assisting to brighten and even out skin tone. With time-release technology to gradually deliver the benefits of Vitamin C to the skin over time, this moisturiser promotes a brighter complexion with a radiant, dewy finish. Ceramides​: Seals in moisture and works as a natural barrier to protect the skin while preventing water loss and improving barrier function, which in turn helps to reduce dryness and irritation while providing a skin-smoothing effect by hydrating the skin.​​ Niacinamide​: Known for its anti-inflammatory, anti-ageing, antioxidant, and skin brightening properties, Niacinamide plays a crucial role in skin cell health.​​ Polyglutamic Acid​: A powerful humectant that holds up to four-thousand times its weight in water to enhance skin hydration and elasticity by forming a moisture reserve for the skin.","Parabens, sulphates, oil, alcohol, gluten and phthalate.","Morning and night. Apply a pea-sized amount after cleansing as the last step before applying Face the Day SPF 50+ or Age Defence SPF 50+ and at night as the final step in your skincare regime. Apply to your face, neck and décolletage.","Skinstitut's Vitamin C Ceramide Moisturiser contains skin identical Ceramides and next-gen hydrator Polyglutamic Acid to help restore and maintain the skins natural moisture barrier for more hydrated, smooth and nourished skin.",https://contenthub-delivery.mecca.com/api/public/content/I-071649-I-071649-M1-Skinstitut-VitaminCCeramideMoisturiser-dGDzIDYGTwGyzinbQN2TgQ.webp?t=blur,https://www.mecca.com/en-au/skinstitut/vitamin-c-ceramide-moisturiser-I-071649/?cgpath=skincare
896,By Terry,Baume de Rose Lip Care Flaconette,$32.00-$83.00,Skincare,Lip Care,,,In Stock,141.0,4.0,"Hydrating, Plumping",Sunflower seed oil: reinforces your natural lipid barrier for improved moisture retention and decreased hydration loss. Rosa centifolia wax: works to protect and soothe the lips.,,"Glide the sponge applicator over the lips. Use alone, or apply in conjunction with other lip products as a hydrating base or glossy finishing touch. For a more intensive lip treatment, apply a generous amount on to the lips and allow to absorb overnight. Apply onto nails and cuticles and massage in.","A cultfavourite lip balm is reimagined in a travelfriendly form for onthego hydration and plumping. This unique nourishing lip treatment helps to both repair and protect the lips. Packaged perfectly for onthego use, the balm is delicately scented and delivers a subtle shine, leaving lips instantly smoothed, protected and softened without irritation or stickiness.",https://contenthub-delivery.mecca.com/api/public/content/I-003627-I-003627-M1-ByTerry-BaumeDeRoseLipCareFlaconnette-V1l6hSU9UGRMhTegukSCg.webp?t=blur,https://www.mecca.com/en-au/by-terry/baume-de-rose-lip-care-flaconette-V-003627/?cgpath=skincare
898,ILIA,Bright Start Activated Eye Cream 15ml,$75.00,Skincare,Eye Care,,15.0,In Stock,1236.0,4.5,"Cruelty-free, Vegan, Hydrating, Brightening, De-puffing, Oil free, Fragrance-free","Sea Fennel Extract: plant-based retinol alternative that visibly brightens, firms, and smooths. Upcycled Avocado Extract: reduces the look of dark circles and puffiness. Caffeine & Peptides: powerful actives that visibly depuff and revive tired eyes.","Gluten, silicones, oil, fragrance, sulphates, phthalates, parabens.","Dispense a small amount and spread under eyes with the ceramic tip. Use the smooth side of the ceramic tip to massage into skin, starting at the temple and moving along the orbital bone towards the inner corner of eyes. Finish by tapping with fingers to help any excess product absorb.","Slow down your morning ritual and wake up eyes with a retinol alternative formula clinically proven to reduce dark circles, puffiness, and wrinkles. A cooling ceramic tip works as a massage tool, and sheer pearl illuminates for a softly brightened look. Lightweight texture layers well under makeup.",https://contenthub-delivery.mecca.com/api/public/content/I-058940-I-058940-m1-ILIA-BrightStartActivatedEyeCream-qG1KoRqcPEaGwaTzs2w0cw.webp?t=blur,https://www.mecca.com/en-au/ilia/bright-start-activated-eye-cream-I-058940/?cgpath=skincare
907,Skinstitut,Face The Day SPF 50+ 75ml,$56.00,Skincare,Sun Protection,,75.0,In Stock,4.0,4.8,"Matte finish, Oil free, Alcohol-free",,"Parabens, sulphates, oil alcohol, gluten, silicones and phthalates.","Apply a generous amount over all exposed areas of the face 20 minutes prior to sun exposure and as the final step in your morning routine. Reapply at regular intervals, especially after swimming, towel drying, exercise or perspiration.","Designed for daily use, this highly functional sunscreen provides weightless protection, while helping to condition the skin. It dries quickly to a matte texture for an un-detectable finish.  This multifunctional formula acts as a broad-spectrum sunscreen, protecting against the sun's harmful UVA/UVB rays, which help prevent premature skin ageing, including wrinkles, fine lines and pigmentation. It also protects against blue light emitted from digital devices that can lead to free radical damage and dullness.",https://contenthub-delivery.mecca.com/api/public/content/I-064598-I-064598-M1-SKINSTITUT-FACE-THE-DAY-SPF50-VpTaMOW6mEuNqTRnSxpfw.webp?t=blur,https://www.mecca.com/en-au/skinstitut/face-the-day-spf-50-I-064598/?cgpath=skincare
908,By Terry,Hyaluronic Global Face Cream,$52.00-$144.00,Skincare,Moisturisers,,,In Stock,103.0,4.7,"Hydrating, Brightening, Plumping, Smoothing","Hyaluronic acid: helps to plump and hydrate skin, locking in moisture. Niacinamide: helps to face and improve the appearance of blemishes on the skin.",Animal products.,"Apply to the skin twice a day in the morning and evening after cleansing. Massage in and upwards, uplifting motion starting at the neck and working it into the face. Pro tip – Mix into any foundation to add an extra hydration boost, lighten the coverage to create a tinted moisturiser & provide a healthy glow.","This face moisturiser has been formulated with eight hyaluronic acids for intense hydration. It plumps, smoothes and illuminates skin. Suitable for all skin types, this cream helps to smooth the appearance of fine lines, wrinkles and gives skin a healthy lasting glow.",https://contenthub-delivery.mecca.com/api/public/content/I-048893-I-048893-M1-ByTerry-HyaluronicGlobalFaceCream-uTRboporeUC2fFNvushA.webp?t=blur,https://www.mecca.com/en-au/by-terry/hyaluronic-global-face-cream-V-048893/?cgpath=skincare
910,Kylie Skin,Vitamin C Serum,$52.00,Skincare,Treatment,,,In Stock,105.0,4.0,,Vitamin C: helps brighten and improve the appearance of dull skin. Camellia oleifera leaf: a potent antioxidant.,"Parabens, sulphates, animal products and testing.",Apply a single pump each morning and evening to clean skin and follow up with moisturiser.,"Fight dull skin and treat your complexion to a slew of brightening and hydrating ingredients. Formulated with vitamin C, camellia oleifera leaf and glycerin, this rich, non-greasy serum delivers on antioxidants, which work to protect and nourish while ensuring skin is hydrated and radiant.",https://contenthub-delivery.mecca.com/api/public/content/I-047477-I-047477-M1-KylieBeauty-VitaminCSerum.webp?t=blur,https://www.mecca.com/en-au/kylie-skin/vitamin-c-serum-I-047477/?cgpath=skincare
911,LA MER,The Lip Volumizer,$150.00,Skincare,Lip Care,,,In Stock,44.0,3.9,"Sheer coverage, Hydrating, Plumping, Smoothing",The Plumping Renewal Complex™: supports natural collagen and youthful fulness. Miracle Broth™: stimulates collagen and elastin production. Lime tea concentrate: rich in antioxidants to neutralise free radicals and protect the skin from environmental damage.,Parabens and sulphites.,"Apply directly onto lips as needed throughout the day.  This multi-use lip treatment is perfect to use alone, layered over or under The Lip Balm, or as a primer before applying colour.","This serum-inspired treatment instantly plumps, visibly softens lines and defines the look of lips. Protected with antioxidants and nourished with healing hydration, one swipe of this gloss not only plumps and perfects your lips, but also helps protect against future damage.",https://contenthub-delivery.mecca.com/api/public/content/I-065641-I-065641-M1-LaMer-LipVolumizerSheerPink-baC85o08S622VPyJ5MfcRw.webp?t=blur,https://www.mecca.com/en-au/la-mer/the-lip-volumizer-V-852561/?cgpath=skincare
915,Allies of Skin,Firming Trio Kit,$108.00,Skincare,Skin Care Packs,,45.0,In Stock,2.0,4.5,"Cruelty-free, Hydrating, Brightening, Exfoliating, Firming, Evens Skin Tone, Smoothing, Fragrance-free","7 Firming Peptides: A unique alliance of 7 Peptides that reduces the appearance of wrinkles and fine lines for smoother and firmer looking skin. 5% Teprenone & Ferulic Complex: A powerful combination that can effectively brighten the appearance of excess pigmentation, hydrate, refine the look of pores, and reduce loss of firmness. 3% Biotech Algae Complex: A breakthrough extract derived from the microalgae Dunaliella salina which helps to increase cell turnover, leading to more luminous, radiant skin. Silk Amino Acids: A natural water-soluble glycoprotein that is extracted from raw silk and acts as a humectant. Provides soothing effect and antioxidant properties and protects skin from environmental aggressors. Organic Moringa Oil: An antioxidant-rich oil extracted from the seeds of the Moringa tree, packed with Vitamins A and C. It is also extremely rich in phytonutrients and fatty acids. Hydrates the skin and strengthens the skin barrier. 20% Ethylated L-Ascorbic Acid: A newer, more stable form of Vitamin C. Fades imperfections, boosts collagen production, and provides excellent photoprotection underneath sunscreen. 2% Orange Extract Complex: Derived from citrus cells, it firms and smooths skin and provides a renewed complexion. 0.05% Dimethylmethoxy Chromanol: A potent antioxidant with a similar structure to Vitamin E. It's known for not only protecting against Reactive Oxygen Species (ROS) but also against Reactive Nitrogen Species (RNS) (both are reactive molecules that cause damage to cells and tissues and are responsible for several mechanisms which trigger skin ageing).","Parabens, sulphates.","Hydrating Cleanser can be used daily AM/PM as a first and/or second cleanse. To remove makeup and sunscreen, massage a dime-sized amount first onto dry skin, then add water and massage again to dissolve daily grime, pollution, sunscreen, and makeup. Rinse and repeat if necessary. After cleansing and misting or toning, apply 1-2 pumps of the Vitamin C Serum to a damp face and neck. Do not apply on dry skin. This product melts into the skin when it comes into contact with moisture, so it's best to apply on very damp skin for optimal absorption. Use the Advanced Daily Treatment the same way as a moisturizer. Apply 1 – 3 pumps to your face and neck daily. Follow up with an SPF in the morning and/or makeup as desired.","A firmer, brighter complexion is 3 steps away. Start your routine with our award-winning face wash, for an effective cleanse that removes makeup, SPF and daily buildup to reveal a softer, fresh-faced skin feeling.",https://contenthub-delivery.mecca.com/api/public/content/I-066522-I-066522-M1-AlliesOfSkin-FirmingTrioKit-gAjZrGQqSdmrCNUSKkmEHA.webp?t=blur,https://www.mecca.com/en-au/allies-of-skin/firming-trio-kit-I-066522/?cgpath=skincare
916,Korres,Greek Yoghurt Coffee Awakening Eye Serum 15mL,$50.00,Skincare,Eye Care,,15.0,In Stock,28.0,4.4,"Hydrating, De-puffing","Greek Yoghurt: delivers instant soothing, cooling sensation with a SuperDose of probiotic extracts to nourish skin. Caffeine extract: a stimulating antioxidant that helps awaken the look of the undereye area.",Parabens and sulfates.,"Apply each morning and evening, gently rolling under each eye, from inner corner to outer corner.","A cooling, roll-on eye gel with nourishing Greek Yoghurt and caffeine for a fatigue free expression that reduces the appearance of dark circles and undereye puffiness.",https://contenthub-delivery.mecca.com/api/public/content/I-056986-I-056986-M1-Korres-GreekYogurtEyeSerum.webp?t=blur,https://www.mecca.com/en-au/korres/greek-yoghurt-coffee-awakening-eye-serum-15ml-I-056986/?cgpath=skincare
918,Kat Burki,Vitamin C Intensive Face Cream,$205.00-$320.00,Skincare,Moisturisers,,,In Stock,142.0,4.8,"Cruelty-free, Vegan, Brightening, Evens Skin Tone","15% Stabilized Vitamin C: A stable form of Vitamin C that releases when absorbed to brighten and protect the skin. KB5™ Complex: A proprietary, deeply calming blend of botanicals. Reishi Mushroom: Promotes skin renewal and rejuvenation. Colloidal Silver: Supports a healthy skin barrier.","Silicone, dimethicone, petrolatum, hydrogenated oils, parabens, sulfates, microplastics, paraffin, perfume/synthetic fragrance, phthalate, cruelty, gluten.","Apply evenly on face, neck, and décolletage after your serum of choice. Massage gently in an upward motion until absorbed. Use AM and/or PM. We recommend patch testing a product you haven’t tried before, especially if it contains active ingredients.","Optimized to transform the skin’s radiance, out top-selling moisturizer hydrates, brightens, and revitalizes dull skin with 15% stabilized Vitamin C, Reishi Mushroom, MSM, and Colloidal Silver.",https://contenthub-delivery.mecca.com/api/public/content/I-031953-I-031953-M1-KatBurki-VitaminCIntensiveFaceCream-btqF8NAsYUqAW0BJn4GaA.webp?t=blur,https://www.mecca.com/en-au/kat-burki/vitamin-c-intensive-face-cream-V-031953/?cgpath=skincare
