Product Number,Brand,Product Name,Price,Category,Subcategory,Weight (g),Weight (ml),Stock Status,Review Count,Rating,Benefits,Key Ingredients,Made Without,Usage,Ingredients,Hero Image,Link
283,Shiseido,Benefiance Wrinkle Smoothing Eye Cream 15ml,$73.00,Skincare,Eye Care,,15.0,In Stock,77.0,4.8,"Hydrating, Firming, Smoothing",ReNeuraRED Technology: make skin regeneration faster and longer-lasting by strengthening the blood vessel wall. Aqua Peptide: addresses the loss of resilience and temporary wrinkles. Carnosine and Peptide component: promotes collagen product and prevent wrinkle settlement.,"silicon, phthalate and sulphates.","In the morning, use before a skincare or makeup product with SPF. In the evening, use as the last step of your skincare routine. Use around the eye area, including the space between the eyebrows. Take a small amount of cream onto the fingertips. Divide and place it under the eyes, at the outer corners, on the eye lids and in between the eyebrows. Gently apply the cream around the eye area, with massage.","Fast and solid results in wrinkle improvement and prevention effect with an ultimate texture. With ReNeuraRED Technology, it breaks the wrinkle streak - 48-hour hydration to reduce fine lines, aqua peptide to address the loss of resilience and temporary wrinkles, and carnosine and peptide component to promote collagen production and prevent wrinkle settlement. Visibly improve wrinkles in 5 days.",https://contenthub-delivery.mecca.com/api/public/content/I-061484-I-061484-M1-Shiseido-BenefianceWrinkleSmoothingEyeCream-hB5YmlDnZkuHnhfywkyg0A.webp?t=blur,https://www.mecca.com/en-au/shiseido/benefiance-wrinkle-smoothing-eye-cream-I-061484/?cgpath=skincare
286,MECCA MAX,FOAM-O Gentle Gel Cleanser 150ML,$18.00,Skincare,Cleanser & Toner,,150.0,In Stock,664.0,4.2,"Cruelty-free, Vegan, Anti-blemish, Hydrating, Soothing, Fragrance-free",Glycerin: to hydrate. Niacinamide & Aloe Vera : to soothe the skin. Citric acid: for gentle exfoliation.,Fragrance (natural & synthetic) and essential oils.,"With wet hands, massage a pea-sized amount across your face and neck and lather into a gentle foam. A little goes a long way! Rinse, pat dry and feel pretty much amazing. Suitable for AM/PM. For external use only. Avoid contact with eyes. Discontinue use if rash or irritation occurs. If you have sensitive skin, patch test this product prior to application. Store in a cool dark place avoiding exposure to direct sunlight or heat.","Dirt, makeup, oil? Time to go. This get-it-done gel cleanser transforms into a lightweight foam for a seriously satisfying clean. Aloe vera, niacinamide and beta glucan get together to hydrate and make washing your face the best part of your day. Use it morning, night or whenever you need a fresh start.",https://contenthub-delivery.mecca.com/api/public/content/I-049213-I-049213-M1-MeccaMax-FoamOGentleGelCleanser-euDkk5rl9UWwMCKFDMaeag.webp?t=blur,https://www.mecca.com/en-au/mecca-max/foam-o-gentle-gel-cleanser-I-049213/?cgpath=skincare
288,Estée Lauder,Advanced Night Repair Synchronized Multi-Recovery Complex,$72.00-$199.00,Skincare,Treatment,,,In Stock,21245.0,4.6,"Hydrating, Smoothing",,"Oil, sulphates, sulfites, parabens, mineral oil, fragrance and phthalates.","Apply this face serum on clean skin before your moisturiser, AM and PM. Use one dropper. Massage in gently all over the face and throat.","Hydrate and nourish skin with this next generation take on Estée Lauder’s iconic Advanced Night Repair serum. With Chronolux™ Power Signal Technology, this deep and fast-penetrating serum helps reduce the appearance of lines and wrinkles caused by environmental aggressors while plumping and firming. The oil-free formula delivers 72-hour hydration while simultaneously providing eight-hour antioxidant power and ensuring skin tone and texture is improved and pores look diminished. This dermatologist and ophthalmologist-tested, non-acnegenic serum leaves skin feeling refreshed and radiant.",https://contenthub-delivery.mecca.com/api/public/content/I-052246-I-052246-M1-EsteeLauder-AdvancedNightRepairSynchronizedMultiRecoveryComplex-CADdLFcQ0qk38qKc8nioQ.webp?t=blur,https://www.mecca.com/en-au/estee-lauder/advanced-night-repair-synchronized-multi-recovery-complex-V-047178/?cgpath=skincare
290,MECCA COSMETICA,Mecca-morphosis Purifying Cleansing Balm 90ML,$48.00,Skincare,Cleanser & Toner,,90.0,In Stock,330.0,4.4,"Hydrating, De-congesting, Exfoliating, Smoothing, Soothing","Olive squalane: supports the natural outer barrier of the skin which may help to calm redness and lock in hydration. Sea buckthorn oil: packed with nourishing omegas and antioxidants, this nourishing oil helps to retain moisturise, soften the skin and repair the skin barrier. Centella asiatica: this potent active is a rich source of amino acids, and is known to calm inflammation, build collagen and improve circulation. Pumpkin enzyme: gently breaks down the dry, dead upper layer of the skin. This results in smoother, softer skin and may help diminish scars and pigmentation.",,Scoop a generous amount with the provided spatula or fingertips. Massage over dry skin in circular motions. Rinse with lukewarm water and dry. Use alone or as part of a double cleansing routine.,"Our Skin Specialists told us that you were asking for a cleanser that effortlessly removes makeup and daily SPF. You were adamant this product had to feel luxurious and silky, smell incredible, and leave no blurry eyes or residue. So, we created it.",https://contenthub-delivery.mecca.com/api/public/content/I-054276-i-054276-m1-MeccaCosmetica-MeccaMorphosisPurifyingCleansingBalm-Eg8KM1cub0CD19L0ys0BQ.webp?t=blur,https://www.mecca.com/en-au/mecca-cosmetica/mecca-morphosis-purifying-cleansing-balm-I-054276/?cgpath=skincare
297,Kiehl's,Ultra Facial Cleanser 150ml,$49.00,Skincare,Cleanser & Toner,,150.0,In Stock,2545.0,4.8,"De-congesting, Fragrance-free","Apricot kernal oil: to moisturise and soften skin while helping tp retain clarity and suppleness. Avocado oil: to provide intensive moisture to the skin. Squalene: to help replenish skin’s barrier, keeping it soft, supple and moisturised.",Fragrance.,"Apply a small amount to clean fingertips. Gently massage into damp facial areas in upward, circular motions, avoiding the immediate eye area. Rinse thoroughly or remove excess with a damp wash cloth.","This pH-balanced cleanser helps to maintain the skin’s natural balance, while removing dirt and debris without over-drying or stripping skin. Suitable for all skin types, after each use excess oil and dirt is dissolved, and skin is left fresh, balanced and ready to take on the day. Gentle and reliable, it's no wonder this cleanser is a Kiehl's fan favourite.",https://contenthub-delivery.mecca.com/api/public/content/I-041331-I-041331-M1-Kiehls-UltraFacialCleanser.webp?t=blur,https://www.mecca.com/en-au/kiehls/ultra-facial-cleanser-I-041331/?cgpath=skincare
301,MECCA COSMETICA,Lip De-Luscious Glide With SPF 15,$32.00,Skincare,Lip Care,,,In Stock,631.0,4.5,"Sheer coverage, Hydrating, Plumping","Shea butter: A rich emollient and a rich source of vitamins A, C and E, which help to restore suppleness, boost and retain moisture and improve skin dryness. Vitamin E: An antioxidant that can fight free radicals and offer anti-inflammatory support, while moisturising, soothing and rejuvenating skin. It keeps skin hydrated by strengthening the skin's barrier and therefore reducing water loss. Hyaluronic Filling Spheres: Strengthens the skin's barrier and adds a subtle plump.",,"Prep lips by exfoliating prior to application for a smooth, even finish.","The cult-favourite Lip De Luscious with SPF 15 has been reimagined in this no-fuss stick version for maximum convenience. Loaded with moisture-optimising hyaluronic filling spheres for plusher plumpness. This silky, non-sticky balm is also laced with a nourishing antioxidant infusion of pomegranate seed oil and vitamin E.",https://contenthub-delivery.mecca.com/api/public/content/I-053924-I-053924-M1-MeccaCosmetica-LipGlide-0PD84CYPv0CiCMY3sBMyPw.webp?t=blur,https://www.mecca.com/en-au/mecca-cosmetica/lip-de-luscious-glide-with-spf-15-V-032391/?cgpath=skincare
315,Origins,GinZing™ Brightening Eye Cream 15ml,$64.00,Skincare,Eye Care,,15.0,In Stock,212.0,4.5,"Hydrating, Brightening, Firming",Vitamin C: helps visibly reduce dark circles. Niacinamide: helps brighten under-eye area + helps visibly energize skin. Panax ginseng & caffeine: boosts natural skin cell energy to help revive radiance. Chicory Root: helps grab moisture and helps lock it into skin.,,"Gently tap onto the eye area with fingertips, both morning and night.","Instantly brighten, hydrate and restore radiance to your under eyes with this revitalising eye cream. Powered by an energising duo of caffeine and panax ginseng, plus niacinamide and vitamin C to brighten. This eye cream helps to reduce the appearance of fatigue whilst softening the look dark circles and puffiness.",https://contenthub-delivery.mecca.com/api/public/content/I-050906-I-050906-M1-Origins-OriginsGinZingRefreshingEyeCreamToBrightenAndDepuff.webp?t=blur,https://www.mecca.com/en-au/origins/ginzing-brightening-eye-cream-I-050906/?cgpath=skincare
322,Mario Badescu,Seaweed Night Cream 30ml,$36.00,Skincare,Moisturisers,,30.0,In Stock,1160.0,4.6,Hydrating,Seaweed: softens and nourishes skin whilst enhancing its natural protective barrier. Collagen: enhances skin tone and texture by smoothing fine lines and wrinkles. Hyaluronic acid: a powerful humectant that maintains the skin’s moisture levels to prevent dehydration.,Oil.,"Apply every evening to cleansed skin. For best results, use over a serum.","Loaded with moisture binding ingredients, this oil-free night cream will smooth, soften and add glow to the skin without feeling heavy or greasy, ensuring you wake up with a youthful glow.",https://contenthub-delivery.mecca.com/api/public/content/I-004664-I-004664-M1-MarioBadescu-SeaweedNightCream-xfMh2z3vuUmQ9Uprc3kdg.webp?t=blur,https://www.mecca.com/en-au/mario-badescu/seaweed-night-cream-I-004664/?cgpath=skincare
326,NARS,Afterglow Lip Balm,$46.00,Skincare,Lip Care,,,In Stock,550.0,4.6,"Sheer coverage, Fragrance-free, Alcohol-free",Monoi oil: delivers long-lasting hydration.,Fragrance and alcohol.,"Apply any tinted shade of Afterglow Lip Balm to bare lips for a sheer tint of colour or as a moisturising base under any lip shade. It can also be used a shiny topcoat. For an even, moisturised base, apply Clean Cut all over lips before applying other NARS lip products.","Swipe on a hint of high-shine colour. Saturate with a surge of long-lasting hydration. It’s a win-win. This balm infuses lips with moisturising ingredients, inviting shine and sheer colour. The blend of antioxidants, including monoi oil, help to protect and condition lips.",https://contenthub-delivery.mecca.com/api/public/content/I-042406-I-042406-M1-Nars-AfterglowLipBalm-RQLOmgKXyEKXI9JsfsGHCQ.webp?t=blur,https://www.mecca.com/en-au/nars/afterglow-lip-balm-V-032450/?cgpath=skincare
331,Korres,Santorini Grape Poreless Skin Cream 40mL,$54.00,Skincare,Moisturisers,,40.0,In Stock,56.0,4.8,"Hydrating, Exfoliating, Firming","Santorini grape extract: From the volcanic ash in which it grows, rich in antioxidants and condensed tannins that help to remove excess oil and reduce the appearance of pores. Salicylic acid: A BHA that exfoliates by removing dead skin cells, unclogging and refining pores.",,"After cleansing, apply to the face and neck, avoiding the eye area.","A lightweight cream that clears the way for pore less looking skin with antioxidant rich, Santorini grape for balanced, all-day hydration.",https://contenthub-delivery.mecca.com/api/public/content/I-063829-I-063829-M1-Korres-SantoriniGrapeCream-wbYsw2Rba0a4MKtHySjw.webp?t=blur,https://www.mecca.com/en-au/korres/santorini-grape-poreless-skin-cream-I-063829/?cgpath=skincare
332,Kosas,Chemistry AHA Serum Deodorant,$30.00,Body,Grooming,,,In Stock,1465.0,4.2,Alcohol-free,"Shikmic acid: derived from star anise to fight odour. Mandelic acid: accelerates cell turnover to fade discolouration. Lactic acid: gently exfoliates and clarifies to reveal brighter, younger looking skin while also sealing in moisture. Aloe vera juice: soothes irritation and redness while hydrating and fighting bacteria. Hyaluronic acid: holds almost 1000 times its own weight in water, instantly plumping the skin with moisture. Aloe vera juice: a powerful moisturizer to soothe and calm skin.","Serene Clean Animal products, alcohol, gluten, mineral oil, aluminium, baking soda, parabens, and sulfates. Fragrance Free Animal products, fragrance, alcohol, gluten, mineral oil, aluminium, baking soda, parabens, and sulfates.",Shake the bottle and rolling on underarms everyday for best results. Gently squeeze for more serum Do not apply to broken skin. Apply on underarms only and discontinue use if irritation occurs. AHA’s may increase sensitivity to the sun so wear sunscreen and limit sun exposure after applying.,"A deodorant powered by skincare ingredients; this revolutionary formula uses AHAs to create a pH environment unliveable for the types of bacteria that cause odour, keeping your underarms fresh all day. Available in both Serene Clean (gently scented) and a Fragrance Free formula. The gentle exfoliating properties from shikmic, mandelic and lactic acids fade the discolouration that occurs in the underarms, leaving them brighter and firmer. Plus, the formula is bound by hyaluronic acid to ensure that your skin is hydrated and plumped when applying.",https://contenthub-delivery.mecca.com/api/public/content/I-045039-I-045039-M1-Kosas-ChemistryAHASerumDeodorant-kI9mvoYB0qWsSNghXaIng.webp?t=blur,https://www.mecca.com/en-au/kosas/chemistry-aha-serum-deodorant-V-814470/?cgpath=skincare
334,Frank Body,Original Face Scrub,$12.00-$26.00,Skincare,Treatment,,,In Stock,197.0,4.6,Brightening,"Roasted coffee grinds: stimulates blood flow, promotes collagen and helps to fade scars. White clay: targets breakouts and removes dead skin cells. Rosehip oil: packed with essential fatty acids and vitamins A and C, which are vital for skin renewal and skin cell repair. Coconut, grapeseed & sweet almond oil: packed with vitamin E to hydrate and nourish your skin.",Parabens and PEGS.,"Massage into damp skin for 30 seconds, paying more attention to the nose, Tzone and chin.","Dull, dry skin? Frank Body's Original Face Scrub to the rescue! This targeted facial exfoliator cleans pores, buffs away dry skin and keeps the skin clear. Thanks to it's blend of roasted coffee grinds, white clay and natural oils, your skin will look glowing and even from the second you rinse it off. Acne doesn't stand a chance. 98.8% Naturally Derived.",https://contenthub-delivery.mecca.com/api/public/content/I-040325-I-040325-M1-FrankBody-OriginalFaceScrub-VF4thKcG7kOgzUJnfoj8w.webp?t=blur,https://www.mecca.com/en-au/frank-body/original-face-scrub-V-040307/?cgpath=skincare
339,Go-To,De-Crease 15ml,$55.00,Skincare,Eye Care,,15.0,In Stock,59.0,4.2,"Hydrating, Brightening, Exfoliating, Firming, Smoothing, Fragrance-free","Retinal: An encapsulated retinaldehyde, which helps to reduce the appearance of crow's feet wrinkles and skin roughness around the eye area. Peptides: Peptides which help to lift the whole eye are and reduce the appearance of fine lines around the eye area. Niacinamide: Also known as vitamin B3, helps to enhance the suppleness of the skin. Gleditsia Triacanthos - Honey Locust - Seed Extract: Rich in polysaccharides which provide a natural tensor effect around the eye area. Albatrellus Confluens - Mushroom - Extract: Helps to soothe and protect the skin.","Silicones, Parabens, Sulfates (SLS/SLES), Petrolatum and mineral oils, Synthetic colours, GMOs.","Apply ½ to one pump each night to cleansed, dry skin and pat gently around the whole eye area. Follow on with other serums, oils and moisturisers. Always use SPF in the daytime. Retinoid use is not recommended during pregnancy or breastfeeding. Always consult your GP to determine exactly what your skin needs during this period.","An effective retinal eye serum to smooth and reduce the appearance of crow's feet wrinkles, and improve hydration, firmness and skin texture.",https://contenthub-delivery.mecca.com/api/public/content/I-065718-I-065718-M1-GoTo-DeCrease-L0BmL4uxlUKIRPI49KulWA.webp?t=blur,https://www.mecca.com/en-au/go-to/de-crease-I-065718/?cgpath=skincare
341,VIOLETTE_FR,Bisou Jelly,$48.00,Skincare,Lip Care,,,In Stock,7.0,5.0,"Cruelty-free, Vegan, Satin finish, Sheer coverage, Fragrance-free","Monk's Pepper: Helps boost collagen production, reduce wrinkle depth, and firm the skin2. Vitamin E: Is known to hydrate and protect the skin from free radicals. Castor Seed Oil: Is know to help soothe skin. Sunflower Seed Oil and Wax: Helps to Soothe and nourishe skin.","Gluten, Phthalates, Parabens and Sulfates.","Prior to first use, prime the bullet on a tissue or your hand to release pigment. The unique jelly outer layer first hydrates your lips, creating a smooth base that allows the colour core to reveal its full intensity. To achieve a just-bitten lip with natural shine, swipe Bisou Jelly flat onto bare lips, applying the jelly layer just above the natural lip line. Layer multiple coats for buildable color payoff. Et voilà!","An antioxidant-rich balm-meets-lipstick that delivers a sheer kiss of couleur and a touch of natural shine. Engineered with two distinct layers—a pigmented core that allows for blurred color within the natural lip, and an outer jelly layer infused with Vitamin E—this unique formula results in juicy, just-been-kissed lips, building on Bisou Balm’s signature French “bouche mordue” (just-bitten lips) look with a volume-enhancing sheen.",https://contenthub-delivery.mecca.com/api/public/content/I-072981-I-072981-M1-VioletteFR-BisouJelly-YDY2juORmtUiLnsT759A.webp?t=blur,https://www.mecca.com/en-au/violette-fr/bisou-jelly-V-072981/?cgpath=skincare
343,Cosmetics 27,Baume 27 Advanced Formula,$199.00-$262.00,Skincare,Moisturisers,,,In Stock,15.0,3.9,"Hydrating, Brightening, Firming","Complex CICA-MA2® (Asiaticoside, Madecassoside, Asiatic Acid): This complex has been clinically tested for its exceptional repairing and regenerating properties on the skin proteins, and as a result, in slowing down skin ageing. The extraordinary properties of Centella Asiatica concentrated in a unique C27 complex with proven properties for regenerating the skin’s proteome and longevity. Glucosamine green-tech: Provides the skin's natural metabolic ""brick"", nourishing skin cells, stimulating their regeneration and promoting the production of GAGs at epidermal and dermal levels. Skin is replenished from within for a deep rejuvenating effect. Celery extract & flaxseed: A combination of flax and celery superseed extracts that help reduce the appearance of open pores. The peptides bring firmness, tone and density to the skin, thus reinforcing the structures around the pore, preventing from sagging. It also refines skin texture and promotes a blurred and satin appearance. Vitamin B3 + prebiotics: Niacinamide, or vitamin B3, is a vitamin that plays an important role on skin homeostasis. A complete ingredient that helps the skin to get rid of blemishes and acne problems and reduces sebum secretion. The combination of these two active ingredients helps fight against skin ageing and maintain hydration.","Parabens, sulfates (SLS-SLES), silicone, mineral oil, PEG, PPG, phthalate, ethanolamine, BHA/BHT, ethoxylated derivative, animal origin ingredient, chemical sunscreen, nanoparticles.",Apply morning and night to a perfectly cleansed skin before your daily skincare routine. Apply two pumps of Baume 27 sérum to the face.,"The iconic Baume 27, boosted with the new Advanced Repair Formula – an intensive global anti-aging cream, with proven advanced efficacy, evolved to be more natural (92% natural origin ingredients) and even more performant. A rich and creamy texture in line with C27 requirements and perfect for dehydrated skin, the advanced formula has been enriched with prebiotics and rice protein to make it even gentler to the skin, it delivers advanced efficacy through the unique Centella Asiatica's CICA-MA2® Complex, signature active ingredient of the Baume 27 range.",https://contenthub-delivery.mecca.com/api/public/content/I-064683-I-064683-M1-Cosmetics27-Baume27AdvancedFormula-GSmmOYk4KkyJqX8eDDkE2w.webp?t=blur,https://www.mecca.com/en-au/cosmetics-27/baume-27-advanced-formula-V-064683/?cgpath=skincare
347,Kitsch,Recycled Plastic Facial Dermaplaners 12 Pieces,$15.00,Hair,Accessories,,,In Stock,57.0,4.3,,,,"To use, hold the dermaplaner blade at a 45-degree angle and gently brush down the skin in the same direction of hair growth. Do not dermaplane directly over acne or irritated skin. Repeat every 3/4 weeks or once skin cell rejuvenation has completed.",The KITSCH dermaplaner gently exfoliates facial skin by removing dead skin cells and unwanted hair that can trap dirt and oil.  Dermaplaning helps prep the skin for smoother make up application and stronger product absorption for a beautiful glow that lasts longer.,https://contenthub-delivery.mecca.com/api/public/content/I-072199-I-072199-M1-Kitsch-RecycledPlasticDermaplanners-Bd9O3VTeR5i1gKt65VNAQ.webp?t=blur,https://www.mecca.com/en-au/kitsch/recycled-plastic-facial-dermaplaners-I-072199/?cgpath=skincare
368,Summer Fridays,Cloud Dew Gel Cream Moisturiser,$28.00-$74.00,Skincare,Moisturisers,,,In Stock,57.0,4.5,"Vegan, Hydrating, Brightening",Hyaluronic acid complex: featuring three types of hyaluronic acid for 72 hour hydration. Amino acids: provide antioxidant support to the skin. Pineapple enzyme: gently exfoliates and brightens for a more even-toned appearance.,"Sulphate, paraben, synthetic dyes or fragrances.",Massage a small amount of product onto cleansed skin. Apply under makeup for a dewy look.,"Glide this ultra lightweight vegan gel-cream all over cleansed skin for a surge of moisture. Infused with three types of hyaluronic acid for non-stop hydration, ceramides, minerals and amino acids to help boost the skin's moisture barrier whilst, antioxidants and pineapple enzymes work to brighten and improve skin's texture and tone. Use this oil-free moisturiser under makeup for a dewy look or by itself for a fresh glow.",https://contenthub-delivery.mecca.com/api/public/content/I-048186-I-048186-M1-SummerFridays-CloudDewGelCream-un5HIbhS26ORAZI5pgcw.webp?t=blur,https://www.mecca.com/en-au/summer-fridays/cloud-dew-gel-cream-moisturiser-V-048186/?cgpath=skincare
371,Kiehl's,Ultra Pure High-Potency 1.5% Hyaluronic Acid Serum 30ml,$55.00,Skincare,Treatment,,30.0,In Stock,62.0,4.6,"Hydrating, Plumping, Fragrance-free",Hyaluronic Acid: helps skin better retain moisture to improve the look of resiliency and make skin feel more supple and bouncy by delivering skin-strengthening hydration.,,"Apply 2-3 drops to clean, dry skin in the morning and evening. Layer with other serums as needed.","A concentrated facial serum formulated with just seven ingredients to help your skin bounce back with replenishing moisture and intensive hydration. With 1.5% Hyaluronic Acid, this facial serum is formulated with just seven ingredients to help replenish dry skin and retain moisture for healthy-looking, hydrated skin. Free of fragrance and colorants, this concentrated serum is minimally formulated for skin absorption and hydration.",https://contenthub-delivery.mecca.com/api/public/content/I-060986-I-060986-m1-kiehls-hyaluronic-acid-30ml-7NmeTtZSE2OT1itk9nw.webp?t=blur,https://www.mecca.com/en-au/kiehls/ultra-pure-high-potency-15-hyaluronic-acid-serum-I-060986/?cgpath=skincare
377,Summer Fridays,Jet Lag Skin Soothing Hydration Mist 50ml,$39.00,Skincare,Cleanser & Toner,,50.0,In Stock,22.0,4.6,"Cruelty-free, Vegan, Hydrating, Brightening, Soothing, Fragrance-free","Glycerin – Attracts and locks in moisture, providing lasting dryness relief that helps skin feel soft and supple. Skin Soothing Complex – Aloe Extract, Bisabolol, Centella Asiatica Extract, Allantoin, Cucumber Extract, and Panthenol work together to calm, comfort and soothe the skin. Skin Barrier Support Complex – Ceramide NP – Essential components of healthy skin cells, keeping the skin’s barrier intact. Squalane – Helps naturally protect the healthy functioning of the moisture barrier. Mineral Complex – Three minerals (Copper Gluconate, Magnesium Aspartate, and Zinc Gluconate) work together to energize the skin and help support healthy skin cell functioning and protect against external factors. Antioxidant Complex – Green Tea Extract + Vitamin E – Help protect the skin against damage from free radicals. Ectoin – An amino acid derivative which helps to support and maintain the water balance in skin + protect against dehydration caused by environmental exposure.","Parabens, Synthetic Dyes, Fragrances, Sulfates, Petroleum. Vegan & Cruelty-Free.","With eyes closed, gently mist holding the product 12 in/30 cm away from the face. Use as the first step in your skincare routine, after makeup application, or as needed throughout the day.","A refreshing facial mist that delivers sheer, lasting hydration that's easy to take on the go and use whenever your skin needs a boost. This formula soothes, replenishes and calms the skin, provides protective moisture barrier support, and leaves skin glowing, dewy and moisturised.",https://contenthub-delivery.mecca.com/api/public/content/I-066240-I-066240-M1-SummerFridays-JetLagHydrationMist-HsMiDTFtQf2ZFL4MjAJGTA.webp?t=blur,https://www.mecca.com/en-au/summer-fridays/jet-lag-skin-soothing-hydration-mist-I-066240/?cgpath=skincare
